"rh","R","A","Q"
"American Art Museums ? Juggle.com---","American Art Museums ? Juggle.com------2 1 1-100 of 134 | Next ? The visual arts are art forms that focus on the creation of works which are primarily visual in nature, such as painting, photography, printmaking, and filmmaking. The following lists American Art Museums where visual arts of all types can be enjoyed. American Art Museums American Art Museums Special Achievements > Lists > Art > Home > Products Television Sports Places Pets Music Literature Government Games Film Events Education Business Autos Works of Art Artists Art Corporate Debates Reference Explore:---Next ? 1-100 of 134 | 1 2 Art (9) Autos (24) Baseball (66) Basketball (26) Business (37) Education (31) Events (20) Film (159) Football (38) Games (48) Government (60) Literature (37) Music (113) Places (35) Television (126) Exploring Art Artists Works of Art Lists in Art Lists in Art Special Achievements Tony Awards Hugo Award American Art Museums Top of Page © 2012 Juggle, LLC All Rights Reserved Find Blog Feedback Site Map"
"Game of the Year - Wikipedia, the free encyclopedia---","Game of the Year - Wikipedia, the free encyclopedia------The winners of the Games (magazine) Game of the Year are chosen by Games editors:[1] See Games 100. [edit] Games magazine [edit] Board games (Game of the Year) X-Play Time (magazine) The Washington Examiner Spike TV ScrewAttack New York Times Metro GameCentral Metacritic Los Angeles Times Kotaku Joystiq Japan Media Arts Festival Japan Game Awards MMGN IGN Giant Bomb GameTrailers GameSpy GameSpot Games (magazine) Games Master GamePro Game Informer Gamasutra G4 Eurogamer Electronic Gaming Monthly Edge (magazine) Crispy Gamer British Academy of Film and Television Arts Academy of Interactive Entertainment Academy of Interactive Arts & Sciences 1UP.com---Apples to Apples Ricochet Robot Double Quick! - Trivia: Bioviva CCG: Pok?mon Dexterity: Spintrek 1999[8] Fossil GIPF Conflict: Atlantic Storm Montgolfiere Bohnanza El Grande Say When! Stormy Seas Alpha Blitz - Trivia: Where in Time is Carmen Sandiego? CCG: C 23 1998[8] Quoridor Balanx Strategy & Conflict: Princess Ryan's Star Marines Take It Easy Get the Goods Quandary Wise and Otherwise Lost in a Jigsaw A to Z - Trivia: Director's Cut CCG: Magic: The Gathering - Portal"
"Game of the Year - Wikipedia, the free encyclopedia---","Game of the Year - Wikipedia, the free encyclopedia------The winners of the Games (magazine) Game of the Year are chosen by Games editors:[1] See Games 100. [edit] Games magazine [edit] Board games (Game of the Year) X-Play Time (magazine) The Washington Examiner Spike TV ScrewAttack New York Times Metro GameCentral Metacritic Los Angeles Times Kotaku Joystiq Japan Media Arts Festival Japan Game Awards MMGN IGN Giant Bomb GameTrailers GameSpy GameSpot Games (magazine) Games Master GamePro Game Informer Gamasutra G4 Eurogamer Electronic Gaming Monthly Edge (magazine) Crispy Gamer British Academy of Film and Television Arts Academy of Interactive Entertainment Academy of Interactive Arts & Sciences 1UP.com---Party/Trivia: Dibs River Crossing Crossword Pyramids Hammer of the Scots Two-Player Card: Balloon Cup 2003[6] DVONN Pueblo Puerto Rico Emerald Vom Kap Bis Kairo (From Cape to Cairo) Mexica Party: Moods Nemesis Factor - Wilderness War Manual Dexterity: Villa Paletti 2002 Evo Morisi Java Africa Babel Lord of the Rings Hilarium Flip-It! My Word! Drive on Paris Manual Dexterity: Space Game 2001 Aladdin's Dragons Z?RTZ"
"---","------The winners of the Electronic Gaming Monthly Game of the Year are chosen by Electronic Gaming Monthly editors. [edit] Electronic Gaming Monthly---[edit] Eurogamer (UK) The winners of the Eurogamer (UK) Game of the Year are chosen by Eurogamer (UK) editors.[39]"
"---","------The winners of the GameSpy Game of the Year are chosen by GameSpy editors.[73] [edit] GameSpy---[edit] GameTrailers The winners of the GameTrailers Game of the Year are chosen by GameTrailers editors.[74]"
"Obsolete: Revealed: press buying and selling private information on a grand scale follow-up.---","Obsolete: Revealed: press buying and selling private information on a grand scale follow-up.------I intended to write so much today, but as usual the best laid plans are the ones that get binned. While today has proved that this is the most disgusting, despicable and reprehensible government that this country has suffered since the last one, the overwhelming torrent of planned news to overshadow the prime minister's questioning by police has also obliterated the information commissioner's publishing of the report (PDF) into how the nation's newspapers (and magazines) are buying and selling personal and private information from government databases on a grand scale. As expected, his full listing was if anything more damning of the press in this country than the condensed one: Revealed: press buying and selling private information on a grand scale follow-up. Thursday, December 14, 2006  « Home | All that's fizzy is not explosive... » | Revealed: press buying and selling private informa... » | Scum-watch: So why isn't the tinsel up on MySpace?... » | Scum-watch: How pathetic can you get? » | Manufacturing hysteria. » | Tolerance for some, not so much for others. » | Unmistakable greed. » | Get in or get out. » | Joy to the world. » | Bringing it home. » ---(Many thanks to Spy Blog for the table.) The scale, through just this one private detective, is astounding. Best magazine, published by Hearst, had 20 different employees buying information from Stephen Whittamore, who himself was receiving the information from at least 3 others; one another private investigator, one a retired cop and the other an ""civilian communications officer"", whatever that is, who was based at Tooting police station. The information sold came at a price of at least ?75 a time; if all of Best magazine's queries cost that amount, then they alone had provided Whittamore and his associates with ?10,050. The Daily Mail's costs alone, not considering the other requests handled for other Rothermere publications, on that same equation, would have come to ?71,400. Best magazine, for those of you who like me had never heard of it, is according to the Grauniad aimed at middle-aged women. The only website I could find that's vaguely associated with it is this one here, which has the above logo with a link below to a survey which is no longer open. No doubt all of its transactions into investigating ""real"
"City Mayors: Largest cities and their mayors in 2011 (Countries A-D)---","City Mayors: Largest cities and their mayors in 2011 (Countries A-D)------The largest cities in the world and their mayors Countries listed in alphabetical order A to D The tables list cities in alphabetical order of their countries. The tables provide city and metro population date. The column ‘mayor’ names the men and women who are carry out political and executive functions. They include elected and appointed mayors, city governors and executive city council leaders. Capital letters denote national capital cities. The research was carried out in 2010 and early 2011. For the population data City Mayors consulted numerous national and international sources and in cases of large statistical inconsistencies elected to publish cautious averages. Readers and scholars are invited to inform of any discrepancies and/or provide missing facts and figures. The data is updated monthly. Please insert ‘Largest cities 2010’ in the subject line of any email. Introduction TABLES: By size of cities: 1 to 150 | 151 to 300 | 301 to 450 | 451 to 600 | City by city: A to D | E to L | M to R | S to Z | Country by country: A to D | E to L |---| Previous | Next © Copyright: City Mayors & Tann vom Hove. All rights reserved City Mayors accepts nominations for the 2012 World Mayor Prize World Mayor 2012 Nominations sought The City Mayors Foundation now seeks nominations for the 2012 World Mayor Prize. The Prize is awarded every two years to a mayor who has made outstanding contributions to his / her community and has developed a vision for urban living and working that is relevant to towns and cities across the world. Online nominations Time table Nominations will be accepted until the middle of May 2012. A shortlist of candidates will be published in early June 2012. The winner of the 2012 World Mayor Prize and other results of the World Mayor Project will be announced in early December 2012. Online nominations Background The City Mayors Foundation, the international think tank on urban affairs, organises the World Mayor Project and awards the World Mayor Prize. The Prize, which has been given since 2004, honours mayors with the vision, passion and skills to"
"Nobel Prize in Physics - The Top 100 Baby Names---","Nobel Prize in Physics - The Top 100 Baby Names------      The 'Everything Baby' Search Engine The Nobel Prize in Physics - Winners---Copyright 2006 © cue32, LLC. All rights reserved.   Contact Us |  Privacy Policy |  Site Map | Baby Names | Global Baby Names | Indian Names |"
"It's Your Vote---","It's Your Vote---------  ITS YOUR VOTE is a free to use website to allow people to express their views about their life and experience living in Ireland. The site is a utility to enable people to communicate openly and constructively in order to bring about positive change.     It is hoped that the site will encourage open dicsussion and provide a platform for those who care about their community, family, lifestyles, security, health and issues that influence their day to day lives to contribute their opinioins and power to improving our environment.    "
"Web 2.0 — PR-Kloster---","Web 2.0 — PR-Kloster------Den gr??ten Sprung hat im Dezember erneut das Mercedes Benz Museum (+1.488 neue Fans) gemacht, das wie der Spitzenreiter c/o Berlin nun auch auf englisch postet. Damit belegt es in der Geasamtwertung mit 11.371 Fans Platz 3. Vielleicht ist das Posting auf englisch der einzige Weg, um ein gr??eres Publikum zu erreichen und eine bestimmte Schwelle oberhalb von 10.000 Fans wirkungsvoll zu durchsto?en. Das Ramones Museum konnte sich um einen Platz verbesser und belegt nun Platz 13 mit 3.201 Fans. Dagegen ist das St?del Museum erneut um einen Rang auf Platz 14 gefallen. Neu in unser Ranking aufgenommen und damit auf Platz 18 ist das Museum Ludwig mit 1.681 Fans, das in den letzten Wochen einen enormen Anstieg verzeichnen konnte. Damit bildet nun das Museum Kunst Palast aus D?sseldorf das Schlusslicht der Top 20 mit 1.507 Fans. Ein Blick auf das aktuelle Facebook-Ranking f?r Museen und Ausstellungshallen zeigt, dass sich die Top 3 immer st?rker ann?hern und weiterhin sukzessive steigern – jedoch mit immer flacher werdenden Zuwachsraten bei den Fan-Zahlen. Das c/o Berlin belegt zu Monatsbeginn weiterhin den ersten Platz mit 13.946 Fans, das NRW-Forum D?sseldorf folgt auf dem zweiten Platz mit 12.270 Anh?ngern. Die Coupon-Aktionen des NRW-Forums, bei denen es Frei-Tickets gab, sind zwar durchaus von den Fans angenommen worden (mehrere hundert Coupons wurden ausgedruckt), aber eine “Explosion” der Fan-Zahlen hat es dadurch nicht gegeben. Welche Museen starten dynamisch ins Jahr 2011? by Maria---18 Museum Ludwig K?ln 1.681 Neu 19 Pergamonmuseum Berlin 1.557 - 20 Museum Kunst Palast D?sseldorf"
"Training unit accreditation — Faculty of pain medicine---","Training unit accreditation — Faculty of pain medicine------New South Wales HK SG| NZ | WA | Vic |  Tas |  SA |  Qld |  NSW |    There are 24 accredited training units in Australia and New Zealand, one in Hong Kong and one in Singapore.   Units wishing to apply for accreditation should complete the questionnaire and submit it to  painmed@anzca.edu.au   The criteria for accrediting a multidisciplinary pain unit are detailed in Professional Document PM2: Guidelines for Units Offering Training in Multidisciplinary Pain Medicine.   The Faculty accredits training units to provide approved training in pain medicine for Faculty of Pain Medicine trainees. Accreditation is based on information provided in a questionnaire to the unit and a site visit by the Faculty to assess a unit's ability to provide training and supervision of the required standard, and its degree of compliance with FPM professional documents. Training unit accreditation Info---Queensland Hospital Hospital ID Director Supervisor(s) of training Contact Royal Brisbane and Women's Hospital 37232 Professor Julia Fleming Dr Bronwyn Williams bronwyne_williams@health.qld.gov.au South Australia Hospital Hospital ID Director Supervisor(s) of training Contact Flinders Medical Centre 37241 Dr Dilip Kapur Dr Porhan Kang porhan.kang@health.sa.gov.au Royal Adelaide  Hospital 37246 Dr Penelope Briscoe Dr Tim Semple rahpainunit@health.sa.gov.au Tasmania Hospital Hospital ID Director Supervisor(s) of training Contact Royal Hobart Hospital 37264 Dr Michael Ashby Dr Hilton Francis gajinder.oberoi@dhhs.tas.gov.au Victoria Hospital Hospital ID Director Supervisor(s) of training Contact Alfred Health Pain Services: Caulfield Pain Management and Research Centre combined with Alfred Acute Pain Services 41123 Dr Carolyn Arnold Dr David Lindholm Geelong Hospital 37276 Dr"
"American Hospital Directory - Individual Hospital Statistics for Florida---","American Hospital Directory - Individual Hospital Statistics for Florida------Data are based on each hospital's most recent cost report and other sources / Definitions Statistics for non-federal, short-term, acute care hospitals. Individual Hospital Statistics for Florida Order Info Updates Sources FAQs FREE Search Home Password: User Name:            ---About the company  |  Site Map  |  Email: support@ahd.com  |  Privacy Policy  |  Media Users should read notice, disclaimer, and agreement  | This page last updated 01/20/2012 Copyright ©2000-2011 American Hospital Directory, Inc. All rights reserved. "
"Mammal Biodiversity Table | Science Naturally---","Mammal Biodiversity Table | Science Naturally------Educational Resources Home > Search Submission Guidelines Sales Info Resellers Contact About Us Fun for Kids Newsletter Awards and Acclaim Reviews Lactation Trivia Facts about Mammals Biodiversity Table Educational Resources Books and Merchandise Catalog Home Menu Your cart Items in 0 Shopping cart---Adapted from: If My Mom Were A Platypus: Animal Babies and their Mothers, by Dia L. Michels, illustrated by Andrew Barthelmes, Platypus Media, 2001, ISBN: 1-930775-02-4. For more information, visit www.PlatypusMedia.com. To request permission to use this in educational settings, please contact: Permission Department, Platypus Media, LLC 627 A Street, NE Washington, DC 20002 Toll-free 1-877-PLATYPS (1-877-752-8977), 202-546-1674, Fax: 202-546-2356 Email: Info@ScienceNaturally.com Web Address: www.PlatypusMedia.com © Science Naturally! All rights Reserved Website created by Stefan Georg Consulting"
"CAIN: Issue: Politics: Elections: Assembly Election (NI) Wednesday 7 March 2007---","CAIN: Issue: Politics: Elections: Assembly Election (NI) Wednesday 7 March 2007------Introduction The following provides the draft results from the 18 Northern Ireland constituencies where the 2007 Northern Ireland Assembly Election was contested. Voting in the election was by Proportional Representation (PR) using the Single Transferable Vote (STV) system. Summary of Results for Northern Ireland Electoral Office for Northern Ireland (EONI). (2007). Number of electorate by ward in each constituency, 1 February 2007, [PDF File; 60KB]. Belfast: EONI. Number of candidates in each constituency Number of Candidates Standing for Each Political Party List of Candidates This page contains the draft results of the 7 March 2007 Northern Ireland Assembly Election. See also:---Pro-Capitalism (ProC) 22 0.00% - 0 - Total 690,313 100.00% 108   Detailed Constituency Results The draft results for each of the 18 constituencies contain the following information: Name of constituency Size of Electorate; Number of Votes Cast (Turnout / Poll); Percentage Turnout / Poll; Number of Invalid / Spoilt Votes; Number of Valid Votes Cast; Percentage Valid Votes Cast; and Quota. Outcome of vote Name of candidate (Party); Number of first preference votes; percentage share of first preference votes; and the count on which the candidate was elected. East Antrim Electorate 56,666 Number of Votes Cast (Turnout / Poll) 30,293 Percentage Turnout / Poll: 53.46% Number of Invalid / Spoilt Votes: 254 Number of Valid Votes Cast: 30,039 Percentage Valid Votes Cast:"
"Tyskland ? historie ? 1 ? Betydningsfulle tyskere ? Store norske leksikon---","Tyskland ? historie ? 1 ? Betydningsfulle tyskere ? Store norske leksikon------Et utvalg tyskere med betydning innen samfunnsliv, kulturliv og vitenskap Betydningsfulle tyskere Betydningsfulle tyskere Innhold Tysklands historie Europa Verdens historie og samtidshistorie Historie Store norske leksikon Tyskland ? historie ? 1 ? Betydningsfulle tyskere Logg inn }); $('#honning').toggle(); }) $('#legal').toggleClass('collapsed'); $('#cite').click(function() { $('#legal').addClass('collapsed'); $('#legal').addClass('collapsible'); }); } return $.waypoints('viewportHeight') - $('#toolBar').height(); offset: function() { }, { } $('#toolBar').addClass('sticky'); } else { $('#toolBar').removeClass('sticky'); if (direction === 'down') { $('#article').waypoint(function(event, direction) { $('#toolBar').addClass('sticky'); $(document).ready(function() {---Se ogs? egne oversikter over statsoverhoder og statsministere sit?r denne artikkelen Vil du sitere denne artikkelen? Kopier denne teksten og lim den inn i litteraturlisten din: Tyskland ? historie ? 1 ? Betydningsfulle tyskere. (16.05.2012) I Store norske leksikon. Hentet fra: http://snl.no/Tyskland ? historie ? 1 Artikkelen har fri lisens og ble sist endret 16.05.2012. se historikk. Foresl? endringer Komment?r Forfatter av denne artikkelen Kunnskapsforlagets papirleksikon Fagansvarlig for Tysklands historie Astrid Sverresdotter Dypvik Astrid Sverresdotter Dypvik (f. 1977), er journalist og historikar med spesiell interesse for Tyskland. Har studert tysk og historie ved Universitetet i Oslo og Universitetet i Leipzig. Skreiv masteroppg?ve i historie om utvisinga av etniske tyskarar fr? aust-europa etter 1945. Har tidlegare arbeidd i Klassekampen, Morgenbladet og Dagbladet. Arbeider no for Nationen. Kan kontaktast p? astrid.dypvik@gmail.com eller p? 91809653. Kommentarer Du m? v?re innlogget for ? kommentere p? denne artikkelen. Opprett profil her. Hva skjer i leksikonet n??"
"Plattenhorn   (766'970 / 183'085)---","Plattenhorn   (766'970 / 183'085)------Folgende Gipfel sind von diesem Punkt erkennbar: Von Norden bis Osten bei maximaler Sichtweite 306 Gipfel, davon 300 über 2000m, 69 über 3000m und keine über 4000m, sind von diesem Punkt aus erkennbar, voraus gesetzt, dass die Sichtweite mindestens 50 km beträgt. Ist die Sichtweite nur 25 km, so sind nur noch 126 Gipfel, davon 125 über 2000m, 10 über 3000m und keine über 4000m, erkennbar. Aber ist die Sichtweite 75 km, sind 359 Gipfel, davon 352 über 2000m, 94 über 3000m und keine über 4000m, erkennbar. 360° Panorama bei maximaler Sichtweite Google Luftbild Landkarte Zentral Graubünden 46.77800N  9.62521O 46°46'41""N  9°37'31""O 766'970 / 183'085 Arosa 1196 GR 2554 Plattenhorn Links  Region  Koordinaten LK 25'000 Kanton Höhe Gipfel Plattenhorn   (766'970 / 183'085)---GR/A 36.93 km 76.6 Verstanclachöpf 3058 GR 33.56 km 77.1 Rothorn 2806 GR 31.08 km 77.2 Bürgenchopf 2923 GR 32.57 km 77.2 Piz Buin Grond 3312 GR/A 38.39 km 77.2 Tiejer Hauptji 2124 GR 7.40 km 77.4 Piz Buin Pitschen 3256 GR/A 37.87 km 77.7 Verstanclahorn 3298 GR 34.73 km 78.4 Chapütschin 3232 GR 34.40 km 78.4 Schwarzkopf 3232 GR 34.40 km 79.0 Pischahorn 2980 GR 24.91 km 79.8 Piz Fliana 3281 GR 37.33 km 80.1 Mederger Flue 2706 GR 9.72 km 80.5 Piz Tiatscha 3051 GR 36.70 km 80.9 Unghürhörner 2994 GR 29.84 km 81.0 Chörbsch Horn 2651"
"World's busiest airports by international passenger traffic - Wikipedia, the free encyclopedia---","World's busiest airports by international passenger traffic - Wikipedia, the free encyclopedia------[edit] 2008 preliminary statistics (January to December 2008) 0.9% 10,646,606 PMI/LEPA Palma, Majorca, Balearic Islands, Spain Palma de Mallorca Airport 30. 1.0% 11,231,417 BRU/EBBR Zaventem, Flemish Brabant, Flanders, Belgium Brussels Airport 29. 5.3% 4 11,416,988 MIA/KMIA Miami-Dade County, Florida, United States Miami International Airport 28 7.3% 11,459,549 STN/EGSS Stansted Mountfitchet, Essex, East of England, England, United Kingdom London Stansted Airport 27. 4.3% 2 11,499,909 BCN/LEBL El---18. Dublin Airport Dublin, Ireland DUB 20,271,485 14.6% 19. John F. Kennedy International Airport New York City, United States JFK 19,606,958 4.4% 20. Copenhagen Airport Copenhagen, Denmark CPH 18,898,625 3.9% 21. Malpensa Airport Milan, Italy MXP 18,654,497 3.9% 22. Manchester Airport Greater Manchester, United Kingdom MAN 18,596,505 0.5% 23. Z?rich Airport Z?rich, Switzerland ZRH 18,444,894 8.0% 24. Toronto Pearson International Airport"
"RBC Royal Bank Rates---","RBC Royal Bank Rates------Cash rates for February 03, 2012 21:00:14 EST Travel Essentials home page The rates on this page are against Canadian Dollars, apply to cash transactions only and are provided merely for information. See additional notes at the end of this page.   Foreign Exchange Rates for Buying and Selling Cash SEARCH   RBC Market Access GIC™ Return Calculator Euro Currency Converter Foreign Exchange Cheque Converter TOOLS  ---NOTES Foreign exchange rates are subject to change at a moment's notice. Although up-to the minute rates may be obtained by contacting a local RBC Royal Bank branch, rates can only be guaranteed at the time the purchase or sale is conducted. Service fees of $3.00 per currency may apply when non RBC Royal Bank clients exchange foreign currency for Canadian dollars. Advance notice may be required to obtain some currencies.   back to top Royal Bank of Canada Website, © 1995-2011 Privacy & Security | Legal | Accessibility"
"Phi Phenomenon -- Top Films According to Fans (S-Z)---","Phi Phenomenon -- Top Films According to Fans (S-Z)------Top Films According to Regular Film Fans (S-Z)---This page was last modified on June 29, 2011"
"Breitstock   (729'675 / 149'625)---","Breitstock   (729'675 / 149'625)------Folgende Gipfel sind von diesem Punkt erkennbar: Von Norden bis Osten bei maximaler Sichtweite 369 Gipfel, davon 368 über 2000m, 153 über 3000m und keine über 4000m, sind von diesem Punkt aus erkennbar, voraus gesetzt, dass die Sichtweite mindestens 50 km beträgt. Ist die Sichtweite nur 25 km, so sind nur noch 170 Gipfel, davon 170 über 2000m, 52 über 3000m und keine über 4000m, erkennbar. Aber ist die Sichtweite 75 km, sind 474 Gipfel, davon 472 über 2000m, 200 über 3000m und 2 über 4000m, erkennbar. Bei maximaler Sichtweite sind sogar 533 Gipfel, davon 531 über 2000m, 234 über 3000m und 3 über 4000m, erkennbar! 360° Panorama bei maximaler Sichtweite Google Luftbild Landkarte 46.48538N  9.12755O 46°29'07""N  9°07'39""O 729'675 / 149'625 Hinterrhein 1254 GR 3030 Breitstock Links Koordinaten LK 25'000 Kanton Höhe---Schafgrat 2763 GR 48.57 km 21.8 Orglen 2720 SG 50.20 km 21.9 Crap Grisch Planggenhorn 2861 GR 20.49 km 22.3 Piz Riein 2752 GR 31.20 km 23.0 Piz Signina 2848 GR 29.15 km 23.3 Piz Fess 2880 GR 29.63 km 23.5 Güner Horn Piz Gün 2849 GR 28.65 km 24.1 Tällihorn 2855 GR 19.83 km 24.2 Marschinchopf 2555 GR 5.37 km 24.3 Oberhorn 2796 GR 30.70 km 25.5 Piz Tomül Wissensteinhorn 2946 GR 17.19 km 26.6 Falknis 2562 GR/FL 71.11 km 27.4 Ruchberg Vorder Grauspitz 2599 GR/FL 71.99 km 27.6 Hinter Grauspitz Schwarzhorn 2574"
"The Magic Box - US Platinum Chart Games.---","The Magic Box - US Platinum Chart Games.------US Platinum Videogame Chart (Games sold over Million Copies since 1995) Last Updated: Dec 27, 2007 Message Forum Flash Games Wallpaper---US Game Chart - Honorable Mentions Platform Developer Game Title Units Sold (Estimates) PS2 Sega NFL 2K3 0.99 Xbox 360 Capcom Dead Rising 0.97 PS2 Namco Soul Calibur 2 0.97 Xbox 360 THQ Saints Row 0.96 PSX Sony The Legend of Dragoon 0.96 PS2 Electronic Arts Burnout 3: Takedown 0.96 PSX Square Enix Final Fantasy Tactics 0.95 GC Nintendo Super Mario Strikers 0.95 PS2 Sony HotShot Golf 3 0.94 Wii Nintendo Super Mario Mario 0.91 PSP Sony SOCOM: Fireteam Bravo 0.91 PSP LucasArts Star Wars: Battlefront II 0.91 PS2 Square Enix Star Ocean: Till the End of Time 0.74 Latest Game News Game Previews"
