"rh","R","A","Q"
"List of most commonly challenged books in the United States - Wikipedia, the free encyclopedia---List of most commonly challenged books in the United States[1][2]","List of most commonly challenged books in the United States - Wikipedia, the free encyclopedia---List of most commonly challenged books in the United States[1][2]---[edit] List In the United States, many books have been challenged by a variety of groups and agencies to prevent a particular work from being read by the general public.[citation needed] In recent years, it has become more common for those challenging the availability of a book to do so on a local level, targeting public libraries and school libraries. Many communities have a formal process by which a citizen may challenge the public availability of a work. This list of most commonly challenged books in the United States lists some of the books challenged from 1990 to 1999 in the United States.[1] This article is missing information about the most commonly challenged books outside the 1990s. This concern has been noted on the talk page where whether or not to include such information may be discussed. (February 2010) e d v---[edit] See also List of books banned by governments [edit] References ^ a b ""100 Most Frequently Challenged Books: 1990?1999"". American Library Association. 2009-07-29. http://www.ala.org/ala/issuesadvocacy/banned/frequentlychallenged/challengedbydecade/1990_1999/index.cfm. Retrieved 2010-04-01.  ^ ""Banned and/or Challenged Books from the Radcliffe Publishing Course top 100 novels of the 20th century"". http://www.ala.org/ala/issuesadvocacy/banned/frequentlychallenged/challengedclassics/index.cfm. Retrieved 2010-09-29.  Retrieved from "" http://en.wikipedia.org/w/index.php?title=List_of_most_commonly_challenged_books_in_the_United_States&oldid=464041731"" Categories: Lists of books Lists of controversial books Censorship in the United States Superlatives Hidden categories: Articles slanted towards recent events from February 2010 Accuracy disputes from"
"Religion popularity and Religion trends---","Religion popularity and Religion trends------// ]]> so.write(""flashcontent_countries""); ); '') '' + '' + 'Countries' + '' + '' + '' + so.addVariable(""additional_chart_settings"", encodeURIComponent( so.addVariable(""data_file"", encodeURIComponent(""/services/countries?term=religion-global"")); so.addVariable(""settings_file"", encodeURIComponent(""/amcharts/ampie_settings22.xml"")); so.addVariable(""path"", """"); var so = new SWFObject(""/amcharts/ampie.swf"", ""ampie"", ""325"", ""220"", ""8"", ""#FFFFFF""); // <script type=""text/javascript""> </div> <strong>You need to upgrade your Flash Player</strong> <div id=""flashcontent_countries""> <script type=""text/javascript"" src=""/amcharts/swfobject.js""></script> <div class=""top_countries""> <div class=""tops""> </style> } margin: 0 auto; .top_lists { } list-style-type: none; .tops li { } margin-left: 15px; .tops .top_media, .tops .top_languages { } float: left; width: 402px; .tops .top_countries, .tops .top_media, .tops .top_languages { } margin: 10px auto; .tops { <style type=""text/css""> <div id=""map_canvas""></div> </script> }; geomap.draw(data, options); }); geomap.draw(data, options); options['region'] = 'world'; options['showZoomOut'] = 'false'; geomap, 'zoomOut', function() { google.visualization.events.addListener( }); geomap.draw(data, options); options['showZoomOut'] = 'true'; } options['region'] = '155'; if (include(['AI', 'AT', 'BE', 'CZ', 'FR', 'DE', 'GG', 'HU', 'JE', 'LI', 'LU', 'MC', 'NL', 'PL', 'SK', 'SI', 'CH', 'UA'], e['region'])) { } options['region'] = '154'; if (include(['AO', 'BY', 'DK', 'EE', 'FI', 'IE', 'IM', 'LV', 'LT', 'NO', 'SJ', 'SE', 'GB'], e['region'])) { } options['region'] = '151'; if (include(['RU'], e['region'])) { } options['region'] = '145'; if (include(['AM', 'AZ', 'BH', 'CY', 'ER', 'GE', 'IR', 'IQ', 'IL', 'JO', 'KW', 'LB', 'OM', 'PS', 'QA', 'SA', 'SY', 'TR', 'TM', 'AE', 'YE'], e['region'])) { } options['region'] = '143'; if (include(['KZ', 'KG', 'TJ', 'UZ'], e['region'])) { } options['region'] = '039'; if (include(['AD', 'BA', 'BG', 'HR', 'GI', 'GR', 'VA', 'IT', 'MK', 'MT', 'MD', 'ME', 'PT', 'RO', 'SM', 'RS', 'ES'], e['region'])) { } options['region'] = '035'; if (include(['AS', 'AU', 'IO', 'BN',---You need to upgrade your Flash Player # Media MIX 1 Dainik Jagran 27.500 2 Dainik Bhaskar 14.000 3 Aajtak TV 7.000 4 CNN Editions (International) 6.000 5 Dinakaran 5.000 6 Malayala Manorama 4.000 7 Divya Bhaskar 3.800 8 Dinamalar 3.500 9 Huffington Post 3.000 10 foxnews 3.000 11 bbc Hindi 2.600 12 indosiar 2.500 13 Softpedia 2.410 14"
"Offizielle Liste der 200 h?chsten Geb?ude der Welt | Statistiken | EMPORIS---","Offizielle Liste der 200 h?chsten Geb?ude der Welt | Statistiken | EMPORIS------Diese Zusammenstellung basiert auf aktuellem Datenmaterial ?ber Geb?ude und legt Datenstandards des Emporis Standards Committee (ESC) zugrunde. Sie ist die mit Abstand verl?sslichste Publikation ihrer Art und wird st?ndig auf Aktualit?t sowie Richtigkeit ?berpr?ft. Es werden ausschlie?lich Hochh?user erfasst, die ihre volle H?he erreicht haben (dies schlie?t Bauten ein, die zur Zeit im Bau sind oder deren Errichtung unterbrochen wurde). Bei der Einbeziehung von Geb?uden wird nur die jeweilige strukturelle H?he gez?hlt. Fernseht?rme, Masten oder andere Geb?udetypen werden nicht ber?cksichtigt. Offizielle Liste der 200 höchsten Gebäude der Welt Data Terms (ESN 45643) Structures (ESN 67890) Geography (ESN 22912) Companies (ESN 32806) Emporis Standards 2000 2001 2002 2003 2004 2005 2006 2007 2008 2009 2010 ?ber den Award Emporis Awards Die meisten---fertiggestellt geplant im Bau nie errichtet abgerissen Bekannt aus: Yahoo! Finance Buiness Journal Reuters ZDF The Times Corporate ?ber uns Kontakt Jobs Referenzen Presse Emporis in den Medien Pressemitteilungen Medieninformationen Downloads Webseite FAQ AGB (EN) Nutzungsbedingungen (EN) Impressum Community Login Registrieren Research Login COPYRIGHT © 2000-2012 EMPORIS GMBH. ALL RIGHTS RESERVED"
"2012 Temkin Ratings ? Temkin Experience Ratings---","2012 Temkin Ratings ? Temkin Experience Ratings------2012 Temkin Experience Ratings Contact Us About Temkin Web Experience Ratings Temkin Customer Service Ratings Temkin Trust Ratings Temkin Forgiveness Ratings Temkin Loyalty Ratings Temkin Experience Ratings Purchase Data Home---See the 2011 Ratings Calculating the Temkin Experience Ratings The Temkin Experience Ratings are based on consumer feedback of their recent interactions with companies. We asked consumers to rate three components of the experience, Functional, Accessible, and Emotional, on a 7-point scale. For each component, we take the percentage of consumers that gave a rating of 6 or 7 and subtract the percentage that gave a rating of 1, 2, or 3. This results in a ?net goodness? rating for each of the three components. The overall Temkin Experience Rating is an average of the three ?net goodness? percentages. For more information, see the Temkin Experience Ratings Overview. Temkin Experience Ratings Temkin Loyalty Ratings Temkin Forgiveness Ratings Temkin Trust Ratings Temkin Customer Service Ratings Temkin Web Experience Ratings"
"Wainwrights---","Wainwrights------The ranking indicates the fell's position in height order, with Scafell Pike being number 1 Select an individual fell to see details and a summit picture.       (Book 7) The Western Fells W     (Book 6) The North Western Fells NW     (Book 5) The Northern Fells N South-western Area SW (Book 4) The Southern Fells S South-eastern Area SE (Book 3) The Central Fells C North-eastern Area NE (Book 2) The Far Eastern Fells FE North-western Area NW (Book 1) The Eastern Fells E   Maps:   Guide Books:   The Wainwrights are the 214 fells described in Alfred Wainwright's seven-volume Pictorial Guide to the Lakeland Fells (1955?1966). The abbreviations for the maps and guide books are as follows:   Links Archives Starting Points Other Summits Outlying Fells---  Return to Home Page          "
"Cyber Fest Noz 2003 - Tableau des d?calages horaires---","Cyber Fest Noz 2003 - Tableau des d?calages horaires------    Z Y X W V U T S R Q P O N M L K J I H G F E D C B A Pays---"
"population of all countries of the world largest to smallest---","population of all countries of the world largest to smallest------An interactive list of countries including their (2010 estimated) populations, as well as land sizes and densities. Click on any of the bolded headings to sort this country list. Type the name of a country you're looking for in the search bar to find its individual stats.---And be the first to see our latest maps, geography facts, travel news, contest clues, photos, videos and much more. To extend this list to the end...please use the navigation arrows to the right. Home  |   Africa  |   Antarctica  |   Arctic  |   Asia  |   Australia  |   Canada  |   Caribbean  |   Central America  |   Europe  |   Islands   Middle East  |   North America  |   South America  |   USA  |   $100 Quiz  |   Featured Photos  |   Featured Videos  "
"List of Virtual Console games (PAL region) - Wikipedia, the free encyclopedia---","List of Virtual Console games (PAL region) - Wikipedia, the free encyclopedia------There are currently 65 games (64 in Europe) available to purchase. [edit] Super Nintendo Entertainment System (800 Wii Points) Hudson Soft 2011-04-15 3 G Adventure Island II Natsume 2011-02-04 7 G S.C.A.T. (600 Wii Points) Hudson Soft 2010-11-26 7 G Faxanadu Natsume 2010-07-09 12 PG Shadow of the Ninja (600 Wii Points) Sunsoft 2010-07-02 7 G Ufouria: The Saga Square Enix 2010-05-07 3 G Final Fantasy (600 Wii Points) Capcom 2010-04-16 7 G Mega Man 4 Sunsoft 2010-04-09 7 G Blaster Master Hudson Soft 2010-03-19 3 G Milon's Secret Castle (600 Wii Points) Hudson Soft 2010-03-12 3 G Lode Runner (600 Wii Points) Majesco 2009-12-18 3 G A Boy and His Blob: Trouble on Blobolonia Nintendo 2009-07-17 3 G Smash Table Tennis (600 Wii Points) Nintendo 2009-07-10 7 G Zoda's Revenge: StarTropics II (600 Wii Points) Nintendo 2009-03-06---[edit] Nintendo 64 (1000 Wii Points) There are currently 21 games available to purchase. Title Publisher EU Release Date AU Release Date PEGI ACB Super Mario 64 Nintendo 2006-12-08 2006-12-07 3 G Mario Kart 64 Nintendo 2007-01-26 3 G The Legend of Zelda: Ocarina of Time Nintendo 2007-02-23 12 PG Lylat Wars Nintendo 2007-04-20 7 PG F-Zero X Nintendo 2007-06-15 3 G Paper Mario Nintendo 2007-07-13 3 G Wave Race 64 Nintendo 2007-08-17 3 G Sin and Punishment (1200 Wii Points) Nintendo 2007-09-28 12 M Yoshi's Story Nintendo 2007-10-26 3 G Pok?mon Snap Nintendo 2007-12-11 3 G 1080? Snowboarding Nintendo 2008-01-18 3 G Kirby 64: The Crystal Shards Nintendo 2008-03-07 3 G Cruis'n USA Nintendo 2008-03-28 7 G Pok?mon Puzzle League Nintendo 2008-05-30 3 G Mario Golf Nintendo 2009-01-23 3 G"
"AM Radio Stations---","AM Radio Stations------Directory (in order of call letters) 1510 - KSPA 1540 - KMPC 1580 - KBLA 1600 - KMNY 1650 - KFOX 1300 - KAZN 1330 - KWKW 1390 - KLTX 1430 - KMRB 1460 - KTYM 1480 - KVNR 1110 - KDIS 1150 - KXTA 1190 - KXMX 1230 - KYPA 1260 - KSUR 1280 - KFRN 870 - KRLA 900 - KALI-AM 930 - KHJ 980 - KFWB 1020 - KTNQ 1070 - KNX 570 - KLAC 640 - KFI 670 - KIRN 710 - KSPN 740 - KBRT 790 - KABC 830 - KMXE By Dial Location (Directory Follows)  ---    Media Main Page Browse to Next Page   Home      |      Visitor Agreement      |      Privacy Statement Copyright ? 2004-2006 by Given Place Media, All Rights Reserved."
"ASGBI Link Surgeons Website---","ASGBI Link Surgeons Website------Local Health Boards and Link Surgeons in this region Select a Surgical Region East of England East Midlands Greater London Ireland North East Northern Ireland North West Scotland South Central South East Coast South West Wales West Midlands Yorkshire and Humber Contact Training Regional Surgical Societies Local Health Boards and Link Surgeons in this region Home Wales Region---  ? Association of Surgeons of Great Britain and Ireland - www.asgbi.org.uk | Design by ASGBI"
"Library | BarraOne Currencies and Countries---","Library | BarraOne Currencies and Countries------BarraOne supports the following countries and currencies. Depending on the context, country codes are either two or three characters. Use the currency codes as identifiers for cash assets when you import your holdings. BarraOne Currencies and Countries   Equity Volatility Futures Commodity Futures MBS   Currencies & Countries ETF   EIF   Bond Futures Instrument Types Benchmarks   } padding: 5px 7px 7px 7px; /* for All other Browsers */ color: #666; background: #FFFFFF; background: #FFF3B3; font-size: 10px; font-family: verdana,arial, sans-serif; #subtabs { #subtabs li:first-child { border-left: none; } } white-space: nowrap; border-left: 1px solid #CCC; padding: 0 8px 0 8px; float: left; #subtabs li { } padding: 0; margin: 0; list-style-type: none; #subtabs ul { } color: #333; text-decoration: none; padding: 6px 4px 6px 10px; border-left: 1px solid #666; border-top: 1px solid #666; border-right: 1px solid #666; background: #FFF3B3; float: left; margin: 0 2px 0 0; top: 0; position: relative; #tabs a.active:hover { } color: #333; text-decoration: none; padding: 6px 4px 6px 10px; border-left: 1px solid #666; border-top: 1px solid #666; border-right: 1px solid #666; background: #FFF3B3; float: left; margin: 0 2px 0 0; top: 0; position: relative; #tabs a.active { } margin-top: 0px; padding: 5px 4px 6px 10px; top: 0; position: relative; font-weight: bold; background: #F6F6F6; #tabs a:hover { } color: #333; text-decoration: none; padding: 5px 8px 5px 10px; border-left: 1px solid #AAA; border-top:---Last modified: 14 October 2011   Support Home | Contact Us | Search | Terms of Use | Privacy Pledge | ? MSCI. All Rights Reserved. Your browser does not support script."
"Europe — Contiki Tours---","Europe — Contiki Tours------Country information Europe is easily one of the most diverse regions of the world. With over 40 countries linked together on the second smallest continent in the world, the variety and range of cultures and experiences Europe provides is simply second to none. With over 60 itineraries as well as custom and charter tour, Contiki's Europe provides something for every traveller, adventurer, vacationer or holiday maker. @import url(""http://downloads.contiki.com/misc/minisites/travel-resources/travel-resources.css"");---Sights and attractions Europe has a phenomenal amount to see. Get your art fix at the Louvre in Paris, or the Academia in Rome, or get your adrenaline pumping with the outdoor activities available in the Austrian Tyrol. Step back in time in Ancient Rome and Greece, or lie on a beach along the stunning Mediterranean Coast. Check out a list of some of the most popular sights and attractions in Europe here. Check out more information on Contiki's Food and Fashion Experience. What to pack Summer Keep in mind this is not a definitive list ? everyone has individual fashion tastes, preferences, opinions, and styles in terms of what they want to wear and bring along! This is meant to be a good guide to help you in packing for your European vacation. Clothes • 1 rainproof jacket/small umbrella • 2 or 3 shorts/skirts • 1 thick sweater • 1 or 2 Swimwear and beach towel • 1 or 2 pairs of jeans • 2 or 3 T-shirts • Underwear • Socks • 2 or 3 casual shirts • Trousers • Dresses • 1 set of nice clothes (eg going out dress, tie, blazer, jacket or suit for evenings"
"How To Be Listed on Dow Jones Industrial Average---","How To Be Listed on Dow Jones Industrial Average------Here’s a look at the current holdings in the Dow Jones: Current Holdings Dow Jones The most common criticism of the Dow is that it only represents 30 companies yet it’s recognized as “The” market indicator.? Even though the S&P 500 represents the top 500 US companies and is a better reflection of our economy, when people ask me about the “market”, I assure you it’s not the s&P 500. It never fails that everyday I get the question, “How did the market do?” or “How’s the market doing?”.? The market that everybody is always referring to is the Dow Jones Industrial Average.? The Dow (for short) was founded May 26, 1896 initially only having 12 companies from important American industries (hence: “Industrial” average).? The Dow currently reflects the top 30 U.S. Companies across it’s various industries.? To compute the Dow that you hear about each day, a lengthy geometric formula is used that takes the price-weighted? stock price of each company and divides by the “DJIA divisor”.? The divisor is a number that is constantly adjust to reflect stock splits, mergers, and dividend payments.? What is the Dow Jones? The Dow Jones Industrial average is heading for a imminent change with the expected bankruptcy filing of auto giant General Motors. With the falling out of the once legendary blue chip stock, many of my clients have inquired to how companies get listed on the Dow Jones Industrial Average and when are they replaced.? I thought---When Does a Stock Get Dropped from the Dow? A stock is dropped from the Dow Jones when it seems warranted.?? As mentioned before, General Motors is presumed to be soon removed from the Dow especially if it files for bankruptcy.? A likely candidate to join GM is (former) banking giant Citigroup. .? Here are some of the more notable changes in recent history: September 22, 2008: Kraft Foods replaced AIG (American International Group) February 19, 2008:? (My wife’s b’day ? Chevron and Bank of America replaced Altria Group and Honeywell April 8, 2004: Pfizer, Verizon, and AIG replaced International Paper, AT&T, and Eastman Kodak Who Will Replace GM? GM out of the Dow? There aren’t any preset rules on how a company gets replaced on the Dow.?? Looking at past replacements, typically the Dow does not replace an exiting company with another in it’s same industry.? Currently, there are several speculations on which company is going to replace them.? A few possibilities include: Cisco, Visa, Amazon, Wells Fargo, and mother Google.? Time will tell. Update: Cisco and Traveler’s Co. will be replacing GM and Citi at the end of trading June 8, 2009. Securities offered through LPL Financial, Member FINRA/SIPC"
"Press Releases, Standards in Public Office Commission---","Press Releases, Standards in Public Office Commission------Table A: Total Exchequer funding of qualified political parties in 2005 under the Electoral Acts and the Party Leaders Allowance The Donation Statements and Statements of Expenditure and Auditors' Reports furnished to the Standards Commission may be inspected and copied by members of the public at its offices at 18 Lower Leeson Street, Dublin 2. The information is also available, in summary form, on the Standards Commission's website www.sipo.gov.ie. Report to the Ceann Comhairle concerning annual Donation Statements in respect of 2005 furnished by political parties. Tables 1 to 5 of this report show details of the donations disclosed by political parties. This report also contains details of returns furnished to the Standards Commission by the ""accounting units"" of political parties. Table 6 of the report gives a summary of the returns received from ""accounting units"". Report to the Ceann Comhairle concerning Statements of Expenditure and Public Auditors' Reports, in respect of 2005, furnished under the Electoral Acts by qualified political parties. Table 1 of this report provides details of the funding received in respect of 2005 while Table 2 shows how the funding was used. Report to the Minister for Finance concerning Statements of Expenditure and Public Auditors' Reports, in respect of 2005, furnished under the Party Leaders Allowance legislation by qualified political parties. Table 1 of this report provides details of the funding received in respect of 2005 while Table 2 shows how the---Issued by the Standards in Public Office Commission on 16 May 2006 Telephone: 01- 6395712 Fax: 01- 6395684 e-mail: sipo@sipo.gov.ie Back to contents Home - Sitemap - Contact Us | | |"
"+ the oc world +---","+ the oc world +------.:: DOPPIATORI ::.---  EDIZIONE ITALIANA: SANDRO FEDELE DOPPIAGGIO ITALIANO: LaBiBi.it SONORIZZAZIONE: N.C. DIALOGHI ITALIANI: ALESSIO CIGLIANO, CECILIA GONNELLI, STEFANELLA MARRAMA, MARCO METE, ANNA RITA PASANISI DIREZIONE DEL DOPPIAGGIO: ALESSIO CIGLIANO, MARCO METE, LUCA WARD ASSISTENTI AL DOPPIAGGIO: FLAVIO CANNELLA, ROBERTA PADOAN MIX: RICCARDO CANINO     fonte: Il mondo dei doppiatori"
"The Atlas of Canada - Lakes---Ontario - Lake Areas and Elevation (lakes larger than 400 square kilometres)","The Atlas of Canada - Lakes---Ontario - Lake Areas and Elevation (lakes larger than 400 square kilometres)---not available not available not available Réservoir Robert Bourassa not available not available not available Lac Guillaume-Delisle not available not available not available Réservoir Manicouagan 389 405 335 Réservoir Dozois 389 444 425 Lac Albanel tidal 452 443 Lac aux Feuilles 564 470 410 Lac Caniapiscau 130 533 508 Lac Payne 232 547 475 Lac Evans 262 576 499 Lacs des Loups Marins 494 584 448 Lac Manouane 195 592 533 Lac Sakami 361 677 484 Réservoir Cabonga 168 761 703 Lac Minto 396 978 802 Réservoir Pipmuacan 98 1003 1002 Lac Saint-Jean 426 1249---* Areas of lake found in Canada. Manitoba - Lake Areas and Elevation (lakes larger than 400 square kilometres) Name of Water Body Net Area (square kilometres) Total Area (square kilometres) Elevation (metres) Lake Winnipeg 23 760 24 387 217 Lake Winnipegosis 5164 5 374 254 Lake Manitoba 4 607 4 624 248 Southern Indian Lake 2 015 2 247 254 Cedar Lake 1 321 1 353 253 Island Lake 1 043 1 223 227 Gods Lake 1 061 1 151 178 Cross Lake 590 755 207 Playgreen Lake 652 657 217 Dauphin Lake 519 519 260 Granville Lake 429"
"Birdwatching Trip Report from Uganda---","Birdwatching Trip Report from Uganda------We followed the itinerary outlined below: Strategy and tips We found the people of Uganda to be very welcoming and experienced no trouble of any kind. The recent successful attacks on the Lords Republican Army by the UPDF in the Sudan are likely to signal the end of this movement and may ensure that the Foreign Office advisory against travel to and within Murchison Falls NP will soon be lifted. We could not heed Sam Woods' excellent advice re timing of trips due to other commitments but can only reinforce what he says on the subject. July/August is great for seeing grassland species (eg bishops and widows) in full plumage, and the weather is benign, but it is a very hard time to be birding generally, especially during dry spells. We had little response to tapes and found things very difficult, especially at Bwindi. Consider going in April/May (during short wet season) or September (just at start of big wet) for better birding (although the roads may be tricky at this time - best to check with Herbert). African green broadbill nests are usually located in April/May and staked out at Mubwindi. We flew with British Airways - booking well in advance secured the best seat prices (?560). Remember to get a visa in advance - available for Uganda High Commission in London - and do check that you are up to date with all your vaccinations. We all took Doxycycline as a malaria prophylaxis.---Euplectes ardens QE, en route to B Fan-tailed widowbird E. axillaris MB, Kaaku Swamp, Kisoro Black bishop E. geirowii QE, en route to B Yellow bishop E. capensis en route to RZ, MG Yellow-mantled widowbird E. macrourus en route to B, MU Red bishop E. orix QE Northern red bishop E. franscicanus MU area Black-winged red bishop E. hordaceus MU area Grey-headed negro-finch Nigrita canicapilla widespread White-breasted negrofinch N. fusconotata widespread Green-winged pytilia Pytilia melba QE, MU area Red-winged pytilia P. phoenicoptera MU area (2 birds in total) Grey-headed oliveback Nesocharis capistrata B (3) Brown twinspot Clytospiza monteiri B Dusky crimsonwing Cryptospiza jacksoni RZ Red-headed bluebill Spermophaga ruficapilla MF Black-bellied seedcracker Pyrenestes ostrinus SM, B Red-cheeked cordonbleu Uraeginthus bengalus MB, LM, B Red-billed firefinch Lagonosticta senegala widespread African firefinch L. rubricata QE, B, MU area Bar-breasted firefinch L. rufopicta MU - pair at regular spot down by Paraa"
