"rh","R","A","Q"
"Gene Mauch | Baseball Prospectus---","Gene Mauch | Baseball Prospectus------requires BP Premium access to view, requires BP Premium or BP Fantasy access to view Gene Mauch is referenced in the following articles. BP Articles No BP Book Comments have been found for this player. BP Annual Player Comments Details Contract Status Agent Service Time Â  Salary Team Year Compensation Reaggravation Surgery Date Severity Injury Body Part Side Games Days Transaction Date Off---BP Chats Date Question Answer 2010-10-12 12:00:00Â (link to chat) So....should I maybe have held off on the Bud Black extension until after he oversaw yet another historic late-season collapse? How many teams, in the span of 4 years, have seen statistical failures as big as the 2007 and 2010 Padres? (Jed Hoyer from San Diego) Gene Mauch to one side, I don't think managers deserve all the blame for late-season collapses. The Padres skid was definitely terrible, and losing 10 games straight is a good way to blow it. But the players played--and lost--those games. Other than Adrian Gonzalez (who hit .361/.439/.528 in those 10 games), the team just plain stunk. Some of that is on Black, but more of it is just on bad play. (Tommy Bennett) 2009-05-12 13:00:00Â (link to chat) Who would you say is the best manager never to win a pennant? (BL from Bozeman) I suppose a lot of people would say Gene Mauch, but I feel like he was overrated. Somehow all his near misses were never his fault... I haven't"
"Brevet US7503498 - Hand-supportable digital image capturing and processing system employing an ... - Googleï¿½Brevets---","Brevet US7503498 - Hand-supportable digital image capturing and processing system employing an ... - Googleï¿½Brevets------Citations de brevets It is understood that the image capture and processing technology employed in bar code symbol reading systems of the illustrative embodiments may be modified in a variety of ways which will become readily apparent to those skilled in the art of having the benefit of the novel teachings disclosed herein. All such modifications and variations of the illustrative embodiments thereof shall be deemed to be within the scope and spirit of the present invention as defined by the Claims to Invention appended hereto. Also, Imaging-Based Bar Code Symbol Readers of the present invention can also be used to capture and process various kinds of graphical images including photos and marks printed on driver licenses, permits, credit cards, debit cards, or the like, in diverse user applications. While the illustrative embodiments of the present invention have been described in connection with various types of bar code symbol reading applications involving 1-D and 2-D bar code structures, it is understood that the present invention can be use to read (i.e. recognize) any machine-readable indicia, dataform, or graphically-encoded form of intelligence, including, but not limited to bar code symbol structures, alphanumeric character recognition strings, handwriting, and diverse dataforms currently known in the art or to be developed in the future. Hereinafter, the term â€œcode symbolâ€? shall be deemed to include all such information carrying structures and other forms of graphically-encoded intelligence. The bar code---28 aoï¿½t 1990 Minolta Camera Kabushiki Kaisha Focus detecting device for use with cameras US4972224 28 aoï¿½t 1989 20 nov. 1990 Polaroid Corporation Exposure control system for a fixed aperture camera US4978981 25 avr. 1989 18 dï¿½c. 1990 Asahi Kogaku Kogyo Kabushiki Kaisha Exposure control device US4996413 27 fï¿½vr. 1990 26 fï¿½vr. 1991 General Electric Company Apparatus and method for reading data from an image detector US5025319 27 juin 1989 18 juin 1991 Fuji Photo Film Co., Ltd. Solid state image pickup device driving method utilizing an electronic shutter operation US5034619 21 sept. 1989 23 juil. 1991 Welch Allyn, Inc. Optical reader with dual vertically oriented photoemitters US5063462 5 dï¿½c. 1989 5 nov. 1991 Canon Kabushiki Kaisha LED array and partitive driving method therefor using overlapping activation periods US5111263 8 fï¿½vr. 1991 5 mai 1992 Eastman Kodak Company Charge-coupled device (CCD) image sensor operable in either interlace or non-interlace mode"
"Difference between revisions of ""Contribute/Bugsquad/BugDays/DolphinDay1"" - KDE TechBase---","Difference between revisions of ""Contribute/Bugsquad/BugDays/DolphinDay1"" - KDE TechBase------Â  You should be working with KDE SC 4 (either 4.4 or newer, preferably 4.5 RC3 or SVN trunk) for testing these bugs. Be sure to join #kde-bugs on irc.freenode.net, as this is where the bug-day will be coordinated. (You can even join now!) Some more information on how to mark bugs can be found on This page. Some bugs may not be reproducible on every installation of KDE. Thus we use a 4-eye principle, having at least 2 triagers look at the bugs before we make any changes on the bugs themselves. If a bug's description is somewhat unclear, try to provide a better step-by-step procedure on how to reproduce it. This will make it easier for developers to find and fix the bug. Check if bugs reported for Dolphin which are previously UNCONFIRMED are reproducible. [edit] Goals of this Bug Day This bug day will take place on Sunday, August 1st 2010, but feel free to start early. The aim of this bug day is to get as many Dolphin-related bugs done as possible. Our target for triage is bugs listed in bugs.kde.org under the product Dolphin. [---18 5 FiNeX done Query 19 5 FiNeX done Query 20 5 Jtamate done Query 21 5 grundleborg done Query 22 5 FiNeX done Query 23 5 anselmolsm done Query 24 5 FiNeX done Query 25 5 FiNeX done Query 26 5 FiNeX done Query 27 5 FiNeX done Query 28 5 FiNeX done"
"Rapala CountDown Fishing Lures---","Rapala CountDown Fishing Lures------Rapala CountDown Lure Specifications: Bass, Walleye, Pike, Musky, Trout, Salmon, Panfish, Redfish, Tarpon, Snook, Tuna, Sea Trout, Striper, Grouper, Peacock Bass, Kingfish, Bluefish, Wahoo, Dolphin Rapala CountDown Lure Species: Hand Tuned & Tank Tested Controlled Depth Technique Large Size Range Custom Action Ideal For Casting Rapala CountDown Lure Features: These lures are great for casting or trolling in freshwater or saltwater. They have a running depth of 1 to 13 feet. Consistently reach suspended fish at any depth with the CountDownÂ® method. The controlled depth technique was introduced to the world with this lure, and to this day is the standard by which all others are measured. Whether the fish are suspending at certain depths near the weed tops or on bottom structure, the CountDown can get you to them consistently. The CD01 size is specifically designed for smaller fish, such as Trout and Panfish. Rapala CountDown Fishing Lures Reviews (0) Description Usually ships within 1-2 business days Ready to purchase? View Available Colors Not Rated Average Rating: In Stock Availability: $7.25 As Low As:---Write Review Your Name: Your Review: Note: HTML is not translated! Rating: BadÂ  Â  Â  Â  Â  Â  Good Enter the code in the box below: Continue 9 Colors Available Only show products that have the following"
"Titanium Nuke | Discraft Distance Driver Golf Disc---","Titanium Nuke | Discraft Distance Driver Golf Disc------""This disc consistently goes farther than I can throw. NUKE was one of the keys to my success at the World Championships."" - Barrett White, World Champ The Pro D and Elite X Nuke are suitable for all skill levels. The Z and ESP Nukes are suitable for intermediate to expert skill levels. ngineering give the NUKE a huge distance advantage and unparalleled velocity with a 1.6 stability rating that makes it more useful to a wider range of players. The Discraft ESP NUKE is a maximum distance driver with a stability rating of 1.6, moderately overstable. This high performance disc is a game changer! The wide, heavy rim and refined aerodynamic engineering give the NUKE a huge distance advantage and unparalleled velocity with a 1.6 stability rating that makes it more useful to a wider range of players. Seize the power! Â  Availability/Stability Rating: Available in Pro D, Elite X, Elite Z, Z-dyed, Z-Glo, Z Sparkle, CryZtal, ESP and Titanium - all with Stability 1.6 Â  The Elite X Nuke is suitable for all skill levels. The Z, ESP andTitanium Nukes are suitable for intermediate to expert skill levels. The Discraft Titanium NUKE is a high performance maximum distance driver disc golf disc that is a game changer! The wide, heavy rim and refined aerodynamic engineering give the NUKE a huge distance advantage and unparalleled velocity with a 1.6 stability rating that makes it more useful to a wider range of---Write a review Rating: Bad Â  Â  Â  Â  Â  Â  Â  Â  Â  Â  Good Your Name: Your Review: Note: HTML is not translated! Enter the code in the box below: Continue Related Products Discraft Nuke - Z CryZtal Fundraiser for Am Worlds 2011 $30.00 Discraft Nuke - Z CryZtal Sparkle Fundraiser for Am Championship 2011 $25.00"
"COURSE SYLLABUS/MASTERS LABOR & EMPLOYEE RELATIONS | School of Management and Labor Relations---","COURSE SYLLABUS/MASTERS LABOR & EMPLOYEE RELATIONS | School of Management and Labor Relations------FALL 2014 Syllabus Kyongji Han Topics in LER: Organizational Behavior Yes 38:578:614:90 Syllabus Janice Fine Organizing for Scoak Change Â  38:578:613:01/37:575:359:01 Syllabus Dorothy Sue Cobble Woman & Labor Movements in Global Perspective Â  38:578:611:01/37:575:335:01 Syllabus Mingwei Liu People Work and Organization Â  38:578:562:01 Syllabus Tami Lee Seminar in Minorities & Work Â  38:578:551:01 Syllabus Carla Katz Labor Law Yes 38:578:550:90 Syllabus Peter Rokkos Finance Analysis & Corporate Governance Â  38:578:538:01 Syllabus Janice Fine Immigration and Public Policy Â  38:578:526:01/37:575:320:01 Syllabus Francis Ryan Public Sector Employment Issues Â  38:578:525:01 Calendar Anne Michelle Marsden The Inclusive Workplace Â  38:578:510 Syllabus Anne Michelle Marsden The Inclusive Workplace Yes 38:578:510:90:91 Syllabus Sheila Lawrence Problem-Solving Tools at Work Â  38:578:503:01 Syllabus Kathleen Sciacchitano Writing in---38:578:530:01 Â  Labor & Corporate Restructuring Saul Rubinstein Syllabus 38:578:541:01 Â  Women and Work Yana Rodgers Syllabus 38:578:541:90 Yes Women and Work Mary Gatta Syllabus 38:578:550:01 Â  American Labor Law Peter DeChiara Syllabus 38:578:555:01 Â  Globalization and the Future of Employment David Bensman Syllabus 38:578:556:01 Â  Organizational Design and Structure Saul Rubinstein Syllabus 38:578:560:01 Â  Collective Bargaining Rosemarie Cipparulo Syllabus 38:578:611:01 Â  Enforcing Worker Rights Janice Fine Syllabus 38:578:612:01 Â  Labor and Employment History Dorothy Sue Cobble Syllabus 38:578:613:01 Â  Topics in LER-Problem Solving Skills Sheila Lawrence Syllabus 38:578:614:90 Yes Topics in Labor and Employment Relations: Organizational Behavior Kyongji Han Syllabus Â  SUMMER 2014 COURSE NO. COURSE NAME PROFESSOR SYLLABUS 38:578:502:T1 Online Writing"
"93 1993 Ford Ranger Engine Mount - Engine Mechanical - Anchor, Beck Arnley, DEA, Westar, Front, Front Left, Front Right, Left, Right - PartsGeek---","93 1993 Ford Ranger Engine Mount - Engine Mechanical - Anchor, Beck Arnley, DEA, Westar, Front, Front Left, Front Right, Left, Right - PartsGeek------Warehouse: A This Product Fits the Following: Ground, Overnight, 2 Day Shipping Options: NewCondition: LeftPosition: Part Number: (1) In Stock Quantity: $26.33 Sale Price: $97.43 Retail Price: (Read reviews) Click to Enlarge DEA Engine Mount - Left W0133-1888866 Select ModelModelSelect MakeMakeSelect Year---DEA Engine Mount - Left Click to Enlarge (Read reviews) Retail Price: $124.30 Sale Price: $24.33 Quantity: (1) In Stock Part Number: W0133-1856374 Position: Left Condition: New Shipping Options: Ground, Overnight, 2 Day This Product Fits the Following: Warehouse: A Vehicle Sub Model Engine â€¢Â 1993 Ford Ranger 4WDÂ  3.0L V6Â "
"3CRR Atlas:3C 299: Data Page---Radio Spectrum","3CRR Atlas:3C 299: Data Page---Radio Spectrum---General Data Optical Line emission Optical Magnitudes Radio Spectrum Spectral Data Position General Data B1419+419 3C 299---10695 0.39 0.02 KNPW79 5000 0.894 0.050 LP80 4900 0.92 0.05 KNPW79 2700 1.63 0.08 KNPW79 2695 1.607 0.040 LP80 1400 3.06 0.10 LP80 966 3.44 0.32 KNPW79 750 4.97 0.20 LP80 178 12.9 1.3 LP80 86 20.5 1.1 LP80 38 34.2 6.8 LP80 Optical Magnitudes Band magnitude Error dereddened? Aperture Reference V 19.48 0.10 Y LR LR00 R(c) 18.51 0.10 Y LR LR00 J 17.35 0.08 Y 10.8"" LL84 H 16.61 0.08 Y 10.8"" LL84 K 15.91 0.06 Y 10.8"" LL84 NB: ""LR"" in the aperture column indicates a magnitude measured on the Laing & Riley system. Optical Line emission Line flux Error Reference 10-16erg/s/cmÂ² [OII] 101 20.0 MC88 (In S.I., the units are 10 -17W m -2). Prev. Main Page Other images Next"
"Foreigner Concert Tickets | SeatGeek---","Foreigner Concert Tickets | SeatGeek------2015 Tour Dates In Secondary Market Listing Range $63 - 1,235 Average Price $75 Cost for Upcoming Foreigner Shows Low price $4 High price $1,126 Average Price $76 Past 12 Months Find Tickets Foreigner Ticket Prices } ); document.getElementById('location-autocomplete') }), } } window.location.href = window.location.pathname + '?lat=' + selection.data.lat + '&lon=' + selection.data.lon + '&location_id=' + selection.data.id } else { window.location.href = window.location.href + '&lat=' + selection.data.lat + '&lon=' + selection.data.lon + '&location_id=' + selection.data.id; if(window.location.href.match('/search')) { SG.GA.sendEvent('team-show-page', 'location-input', { label: selection.term }); onSelect: function(selection) { }, return (data.results && data.results.location) ? data.results.location : [] dataExtractionFunction: function(data) { placeholder: 'Search by City...', postSelectLoad: true, limit: 3, contentKey: 'term', idKey: 'id', queryString: ""types[]=location"", source: ""/autocomplete"", React.createFactory(Autocomplete)({ React.render( if (document.getElementById('location-autocomplete')) {---4/18/2015 San Tan Valley AZ Encanterra Country Club 4/24/2015 Valley Center CA Harrahs Resort Southern California 4/25/2015 Primm NV Star of the Desert Arena 5/8/2015 Southaven MS BankPlus Amphitheater at Snowden Grove 5/29/2015 Glen Allen VA Innsbrook After Hours at Snagajob Pavilion 6/6/2015 Stateline NV Montbleu Resort 6/24/2015 Hartford CT Xfinity Theatre 6/25/2015 Mansfield MA Xfinity Center 6/27/2015 Scranton PA Toyota Pavilion at Montage Mountain 6/28/2015 Burgettstown PA First Niagara Pavilion 6/30/2015 Holmdel NJ PNC Bank Arts Center 7/2/2015 Saratoga Springs NY Saratoga Performing Arts Center 7/3/2015 Bethel NY Bethel Woods Center for the Arts 7/7/2015 Camden NJ Susquehanna Bank Center 7/8/2015 Bristow VA Jiffy Lube Live 7/10/2015 Virginia Beach VA Farm Bureau Live at Virginia Beach 7/11/2015 Raleigh NC Walnut Creek Amphitheatre 7/14/2015 Charlotte NC PNC Music Pavilion 7/16/2015 West Palm Beach FL Perfect Vodka Amphitheatre"
"Dirty Beaches - Badlands (Vinyl LP) - Amoeba Music---","Dirty Beaches - Badlands (Vinyl LP) - Amoeba Music------Track Listing SHIPS FREE in U.S. $18.98 BUY Dirty Beaches Badlands (LP) Tweet Badlands (LP) Home View More Dirty Beaches Badlands (CD) Dirty Beaches Badlands (LP) Haunted Hearts Something That Feels Bad (7"") Dirty Beaches---Side B Titles Artist Length 1. True Blue Dirty Beaches 02:51 2. Lord Knows Best Dirty Beaches 03:24 3. Black Nylon Dirty Beaches 02:50 4. Hotel Dirty Beaches 02:02 BUY $18.98 SHIPS FREE in U.S. User Reviews Overall Rating 0 Submissions RATE & REVIEW"
"Linux Gaming News Â» LGN : Past, Present, Future And Stats.---","Linux Gaming News Â» LGN : Past, Present, Future And Stats.------Top Posts for all days ending 2010-08-16 (Summarized) The most popular pages like last time where, the Main LGN page, â€œUpcoming GNU/Linux Gamesâ€? and â€œRecently Releasedâ€?. The most popular posts where â€œHeroes Of Newerth Gone Retail !â€?, â€œInterview With Frictional Games â€“ Amnesiaâ€? and surprisingly â€œMaxi Mini Golf â€“ Released !â€?. Overall LGN had 108,883 views ! Here you can see those stats in more detail : First of all here are the 13 months visitors graph, the most popular month had 16,860 visitors due to some websites (which I thank later in this post) linking to LGN articles : Meanwhile I would like to show you some of LGN stats on linux-hardcore as the new or original blog will have to start from scratch. If you wonâ€™t hear any more info by the end of the month the LGN official link would be the original http://linuxgamingnews.wordpress.com I am not blaming Rich and can understand him very well â€“ but now we must face the present and prepare for the future. LGN under linux-hardcore will close by the end of the month and we got 2 options : 1. Go back to the original wordpress blog : http://linuxgamingnews.wordpress.com (Iâ€™ve already imported all the articles,setup a new theme, but the links are currently messed up). 2. Buy---More Details On Primal Carnage 524 Natural Selection 2 and GNU/Linux 510 Trauma â€“ Flash Based Point-and-Click Adventure 506 The MMORPG Ryzom Goes Free Software ! 492 Dark Salvation â€“ Horror FPS ! 488 Eschalon: Book II Released For GNU/Linux ! 475 Garshasp â€“ Action Adventure Game 473 Interview With Koen From Koonsolo 453 GNU/Linux users show their love for indie game â€“ By Koonsolo 447 Vote For Torchlight GNU/Linux Port ! 440 Mystery of Solarus DX â€“ Zelda Remake ! 440"
"Patent US2902760 - Scribing instrument - Google Patents---","Patent US2902760 - Scribing instrument - Google Patents------Patent Citations References lCited in the file of this patent UNITED STATES PATENTS 1,017,287 Gran et al Feb. 13, 1912 2,744,329 Way et al. May 8, 19,56 l 2,748,474 Brown ,June 5, 1956 FOREIGN PATENTS A 80,177 `-Germany Mar. 7, 1895 2. A scriber comprising a heavy body provided with three feet for engaging a surface to be scribed, a vertical cylindrical member carried by said body, a member sliding within said vertical cylindrical member and carrying a scribing tool at its lower end and a compression spring mounted Within Y said vertical cylindrical member and urging the member carrying the scribing tool downward against the surface to be scribed, a pin extending horizontally from said vertical cylindrical member, a lever having a hollow handle portion engaging said horizontal pin to pivot said lever von said vertical cylindrical member 'and a yoke portion partially extending around said vertical cylindrical member, means extending inward from 'said yoke portion of said lever through slots in said vertical cylindrical member and engaging the member carrying the scribing tool, whereby the member carrying the scribing tool may be urged upwardly by said lever to ""compress said spring and relieve the pressure on the scribingtool, said slots in said vertical cylindrical member terminating in notches which engage the means exftending inward from said yoke portion of said lever to engage the member carrying the scribing tool toy hold said spring in---US4974324 * Jul 28, 1989 Dec 4, 1990 Somar Corporation Appliance for cutting out thin film US4991274 * Dec 19, 1988 Feb 12, 1991 Ray Fortier Tool holder for burnishing cutter US5094134 * Jun 8, 1990 Mar 10, 1992 Roland Dg Corporation Cutting pen US5605085 * Apr 19, 1994 Feb 25, 1997 Laborsaber, Inc. Circle cutting device US6619172 * Jul 16, 2001 Sep 16, 2003 Mimix Template tracing cutter US6834434 Sep 23, 2003 Dec 28, 2004 Lance Nelson Spring-loaded engraving toolholder US20110191979 * Aug 11, 2011 Boren Dane A Methods of Using Cutting Devices for Printing, Devices for Performing the Same, and Systems including such Devices * Cited by examiner Classifications"
"Cast of Star Wars Quiz - By oldkent---","Cast of Star Wars Quiz - By oldkent------Full Results Challenge Friends Replay Game Share Result Average Score: % % correct You got Enter answer: Challenge Play Timer 05:00 ll Score 0/26 var showNext = true; function displayAnswer(answerSlot, answer, gameOver) { /* If the game is over and either bonus answers are wrong, or the showNext flag has been set to false, we won't display the answer text */ var showAnswer = (gameOver === true && (_spwr || !showNext)) ? false : showans; var theAnswer = (!showAnswer &&---Character Actor Episodes R2-D2 Episodes I to VI Yoda Episodes I to III and V to VI C-3P0 (Voice) Episodes I to VI Boba Fett Episode II Boba Fett Episode IV Boba Fett Episodes V and VI Jabba the Hutt Episodes I and IV Jabba the Hut Episode VI Jango Fett Episode II Jar Jar Binks Episodes I to III Mace Windu Episodes I to III Han Solo Episodes IV to VI Princess Leia Episodes IV to VI You're not logged in! Compare scores with friends"
"High School Sports | Jan. 22 2013 girls basketball Box Elder-Sky View | Deseret News---","High School Sports | Jan. 22 2013 girls basketball Box Elder-Sky View | Deseret News------Individual stats Tara Goldman had a monster game for Sky View in its victory as she nearly recorded a triple-double. Goldman ended with 18 points, 10 boards and added nine steals to the mix. Sky View totals Field goals: 26 Â  Free-throws: 14 -15 (93.3%) Box Elder totals Field goals: 14 Â  Free-throws: 4 -8 (50.0%) 68 15 18 16 19 Sky View 32 6 8 10 8 Box Elder Total 4 3 2 1 Â  Tuesday, Jan. 22, 2013 | Region 05 | Played at Sky View Tuesday, Jan. 22, 2013 }; } var shareBar = new DNHsGameView(); onload : function() { }, afterShare: false defaults: { copypaste: false, shareQuote: false, var pwidget_config = { // Po.st config }(document, 'script', 'twitter-wjs'); } fjs.parentNode.insertBefore(js,fjs); js=d.createElement(s);js.id=id;js.src=p+'://platform.twitter.com/widgets.js'; if(!d.getElementById(id)){ p=/^http:/.test(d.location)?'http':'https'; var Final 68 32 Sky View Box Elder---What You May Have Missed Teacher unions and civil rights groups battle over future of No Child Left Behind Getting serious about water safety saves lives, experts say Three-quarters of 21st-century parents use social media for advice Sign up for news updates Advertise with us Report this ad"
"Students Dumpster dive to kick off district recycling program | TheAndersonNews.com---","Students Dumpster dive to kick off district recycling program | TheAndersonNews.com------Â» Â  March Â« Â  EVENTS CALENDAR }); googletag.display(""gam-holder-003-NP-300x60"");---Upcoming Events Home News Education Community News Public Records Sports Anderson County High School Anderson County Middle School Christian Academy of Lawrenceburg Columns College Outdoors Opinion Editorials Letters Columns Readers Forum Blogs Obituaries Features The Way We Were Society Calendar Church News Special Sections Classifieds Business for Sale Homes.com Jobs Place An Ad Local Classifieds Public Notices"
"Ravelry: Hook Candy designs---","Ravelry: Hook Candy designs------next page â†’ 2 1 Â  pattern store 43 designs overview patterns > designers > Hook Candy groups forums people yarns patterns my notebook create an account Sign in or Howdy, stranger!---Â  1 2 next page â†’ Home | About Us | Advertising | Help | Goodies | Mobile & Apps | API | Terms of Use & Privacy"
"Restorations Concert Tickets | SeatGeek---","Restorations Concert Tickets | SeatGeek------2015 Tour Dates Low price $13 High price $96 Average Price $47 Past 12 Months Find Tickets Restorations Ticket Prices } ); document.getElementById('location-autocomplete') }), } } window.location.href = window.location.pathname + '?lat=' + selection.data.lat + '&lon=' + selection.data.lon + '&location_id=' + selection.data.id } else { window.location.href = window.location.href + '&lat=' + selection.data.lat + '&lon=' + selection.data.lon + '&location_id=' + selection.data.id; if(window.location.href.match('/search')) { SG.GA.sendEvent('team-show-page', 'location-input', { label: selection.term }); onSelect: function(selection) { }, return (data.results && data.results.location) ? data.results.location : [] dataExtractionFunction: function(data) { placeholder: 'Search by City...', postSelectLoad: true, limit: 3, contentKey: 'term', idKey: 'id', queryString: ""types[]=location"", source: ""/autocomplete"", React.createFactory(Autocomplete)({ React.render( if (document.getElementById('location-autocomplete')) {---date city state venue 2/8/2014 Philadelphia PA Boot & Saddle 4/15/2014 Bristol Bst The Exchange 4/16/2014 Brixton Lbh The Windmill 4/17/2014 Manchester Man The Star and Garter 4/18/2014 Glasgow Glg Audio Glasgow 4/20/2014 Newport Nwp Le Pub 4/24/2014 Southampton Southampton Joiners 5/2/2014 Meerhout Vlg De Vlessenhoeve 5/5/2014 Hannover NI Bei Chez Heinz 5/15/2014 Karlsruhe Baden-wurttemberg Jubez Karlsruhe 6/26/2014 Washington DC Rock and Roll Hotel 6/28/2014 New York NY The Studio at Webster Hall 9/6/2014 Syracuse NY Westcott Community Center 9/6/2014 Toronto ON Downsview Park 9/9/2014 Detroit MI Magic Stick 9/10/2014 Cleveland OH Beachland Tavern 9/11/2014 Columbus OH Park Street Saloon 10/17/2014 Newark DE University of Delaware 10/25/2014 Washington DC DC9 Nightclub 10/26/2014 Charlotte NC Tremont Music Hall 10/29/2014 Tampa FL The Orpheum"
