"rh","R","A","Q"
"Paper Claw---","Paper Claw------Â  Add Images Â  I Made it! We have a be nice comment policy. Please be positive and constructive. ""I Made It"" comments require images. Uncheck for normal comment. Ã— Preview Your Comment Spam Inappropriate Not Nice---DaVidMaker 6 months agoReply Even though you don't like people seeing you on the internet, that paper mask is beast! pork_N_chop 2 years agoReply Be more descriptive ""Wrap it around"" Wrap what around"
"sheloc | Apple iPad Forum---","sheloc | Apple iPad Forum------Post Ratings 0 Neutral ratings received: 0 Positive ratings received: 0 Trophy Points: 4 Messages: Sep 5, 2011 Joined: Mar 18, 2014 Last Activity: You are using an out of date browser. It may not display this or other websites correctly. You should upgrade or use an alternative browser.---Location: montreal Share This Page Tweet sheloc iPF Noob, from montreal sheloc was last seen: Mar 18, 2014 Profile Posts Recent Activity Postings Information Areas There are no messages on sheloc's profile yet. Show Ignored Content Loading... View Loading... View About Location: montreal Interact Content: Find all content by sheloc"
"Residence for Mr. & Mrs. L. Fallis: Kitchen :: Architectural Drawings---","Residence for Mr. & Mrs. L. Fallis: Kitchen :: Architectural Drawings------View Description Residence for Mr. & Mrs. L. Fallis: Kitchen To embed this object, paste this HTML in website To link to this object, paste this link in email, IM or document Save to favorites Remove from favorites var isPageAFave = """"; var isAFav = ""no"";---} if($('#img_view_text_container').exists() ){ $('#img_view_text_container').show(); } if($('#co-tabs').exists() ){ $('#co-tabs').show(); } }); Description Rating Project Name Residence for Mr. & Mrs. L. Fallis Sheet Title Residence for Mr. & Mrs. L. Fallis: Kitchen Creator Bolton and Barnstone, Architects Description Rendering of kitchen with breakfast nook for Mr. and Mrs. Fallis. Porch is visible to the right of the kitchen. Source Paper ; Rendering Job Number 5616"
"Warlords for Atari 2600 (1981) - MobyGames---","Warlords for Atari 2600 (1981) - MobyGames------User Reviews Warlords variant Part of the Following Group add alternate title] [ ""Kings in the Corner break-out game"" -- Working title Alternate Titles add screenshots] 3 more | [ Screenshots edit description] [ DescriptionIn Warlords, you need to defend yourself from three human and/or computer players. Each of the four players are in one of the corners of the screen guarded by a castle. You control a small shield which can be moved around the edge of the castle. To survive you need to use the shield to block a ball which bounces around the screen. If the ball hits your castle, it will take out some of the bricks. If a hole forms in the castle wall and the ball makes it though and hits your warlord, then you are out of the game. The last player left alive wins the battle, and the first player to win five battles wins the game! Several game options are included which allow you to either catch or ricochet the ball when the shield touches it, and control the speed---The Video Game Critic Jul 10, 2010 A 100 The Atari Times Sep 04, 2003 85 out of 100 85 neXGam Jun 27, 2013 8.3 out of 10 83 Tilt Sep, 1982 4 out of 6 67 [ addÂ review] Forums There are currently no topics for this game. [ new thread] Trivia 1001 Video Games Warlords appears in the book 1001 Video Games You Must Play Before You Die by General Editor Tony Mott. Awards Flux Magazine (Issue #4) - #78 on the ""Top 100 Video Games of All-Time"" list Game Informer Magazine August 2001 (Issue #100) - #25 on the ""Top 100 Games of All Time"" poll Retro Gamer Magazine (Issue #46) - #8 on the â€œTop 25 Atari 2600â€? Games poll Information also contributed by Big John WV [ add trivia] Servo (55772) added Warlords (Atari 2600) on May 09, 2003 Other platforms contributed by FatherJack (58530)"
"My lego minifig collection: A LEGOÂ® creation by ryan cocks : MOCpages.com---","My lego minifig collection: A LEGOÂ® creation by ryan cocks : MOCpages.com------//--> google_color_url = ""999999""; google_color_text = ""444444""; google_color_link = ""0066FF""; google_color_bg = ""FFFFFF""; google_color_border = ""6E99C9""; google_ad_channel = ""5686423283""; //2007-08-03: header google_ad_type = ""text_image""; google_ad_format = ""728x90_as""; google_ad_height = 90; google_ad_width = 728; google_ad_client = ""pub-3999042681167112""; amazon_ad_include = ""lego"";//--> amazon_color_logo = ""666666""; amazon_color_price = ""ff0000""; amazon_color_link = ""33CCFF""; amazon_color_text = ""444444""; amazon_color_background = ""ffffff""; amazon_color_border = ""ffffff""; amazon_ad_price = ""retail""; amazon_ad_height = ""600""; amazon_ad_width = ""160""; amazon_ad_tag = ""mocpages-20""; document.write(ts+'script src=""http://www.burstnet.com/cgi-bin/ads/ad17591a.cgi/v=2.3S/sz=120x600A|160x600A/'+rnum+'/'+nf+'RETURN-CODE/JS/"">'+ts+'/script>'); if (window.self != window.top) {nf=''} else {nf='NF/'}; ts=String.fromCharCode(60); rnum=Math.round(Math.random() * 100000);---About MOCpages | Advertise | Help MOCpages is an unofficial, fan-created website. LEGOÂ® and the brick configuration are property of The LEGO Group, which does not sponsor, own, or endorse this site. Â©2002-2015 Sean Kenney Design Inc | Privacy policy | Terms of use"
"Poll - Mystic Games---","Poll - Mystic Games------27% 10% of my yearly income or more 27% About 5% of my yearly income 27% About 1% of my yearly income. 27% Nothing. I don't give to charity. Total Voters: 1389 My yearly donations to charity amount to: Quick Poll Results Oracle Articles Dreams Names---LinksÂ |Â  Contact UsÂ |Â  Terms of UseÂ |Â  Privacy NoticeÂ  Copyright Â© 1998-2007 Mysticgames.com. All rights reserved. Use of our website is subject to the Terms of Use."
"Maria Ruiz | PeopleFinders---","Maria Ruiz | PeopleFinders------view details Â  Relatives Marital Status Birth Year Birth Place Person Birth Records Â  padding-bottom-md text-grey col-no-padding""> Relatives: Single Marital Status: 1884 Birth Year: Mexico Birth Place: MariaÂ Ruiz Person: Relatives: , (608)512-**** , (732)613-**** , (224)623-****---Person: MariaÂ Ruiz Birth Place: Arizona Birth Year: 1894 Marital Status: Single Relatives: view details Person: MariaÂ Ruiz Birth Place: Arizona Birth Year: 1894 Marital Status: Single Relatives:"
"EUROPA - European Commission - Growth - Regulatory policy - NANDO---","EUROPA - European Commission - Growth - Regulatory policy - NANDO------Â  Body : FLEETWOOD TESTING LABORATORY BLACKPOOL and the FYLDE COLLEGE Blackpool &amp; the Fylde College Fleetwood Nautical Campus Broadwater Fleetwood FY7 8JZ Lancashire Country : United Kingdom Phone : +44.125.377.91.23 Fax : +44.125.377.30.14 Email : Brooke.Smith@blackpool.ac.uk Website : www.blackpool.ac.uk/fosc Notified Body number : 0514 Version(s): 1 2 3 4 Last update : 10/06/2014 Â  Â  Found : 2 Notification $('.js-fallback').hide();---"
"Jane Murray | PeopleFinders---","Jane Murray | PeopleFinders------view details Â  Relatives Marital Status Birth Year Birth Place Person Birth Records Â  padding-bottom-md text-grey col-no-padding""> Relatives: Single Marital Status: 1898 Birth Year: Alabama Birth Place: JaneÂ Murray Person: , Jane E Muurry , Michelle L Houghtby Robin J Murray Relatives:---Person: JaneÂ MÂ Murray Birth Place: Ireland Birth Year: 1846 Marital Status: Widowed Relatives: view details Person: JaneÂ MÂ Murray Birth Place: Ireland Birth Year: 1846 Marital Status: Widowed Relatives:"
"phpinfo()---","phpinfo()---------Registered Stream Socket Transports tcp, udp, unix, udg, ssl, sslv3, sslv2, tls Registered Stream Filters zlib.*, bzip2.*, convert.iconv.*, string.rot13, string.toupper, string.tolower, string.strip_tags, convert.*, consumed, dechunk This program makes use of the Zend Scripting Language Engine: ZendÂ EngineÂ v2.3.0,Â CopyrightÂ (c)Â 1998-2010Â ZendÂ Technologies Configuration apache2handler Apache Version Apache/2.2.15 (Red Hat) Apache API Version 20051115 Server Administrator buc-edicion@buc.ucm.es Hostname:Port eprints.ucm.es:0 User/Group eprints(503)/501 Max Requests Per Child: 4000 - Keep Alive: off - Max Per Connection: 100 Timeouts Connection: 60 - Keep-Alive: 15 Virtual Server Yes Server Root /etc/httpd Loaded Modules core prefork http_core mod_so mod_auth_basic mod_auth_digest mod_authn_file mod_authn_alias mod_authn_anon mod_authn_dbm mod_authn_default mod_authz_host mod_authz_user mod_authz_owner mod_authz_groupfile mod_authz_dbm mod_authz_default util_ldap mod_authnz_ldap mod_include mod_log_config mod_logio mod_env mod_ext_filter mod_mime_magic mod_expires mod_deflate mod_headers mod_usertrack mod_setenvif mod_mime mod_dav mod_status mod_autoindex mod_info mod_dav_fs mod_vhost_alias mod_negotiation mod_dir mod_actions mod_speling mod_userdir mod_alias mod_substitute mod_rewrite mod_proxy mod_proxy_balancer mod_proxy_ftp mod_proxy_http mod_proxy_ajp mod_proxy_connect mod_cache mod_suexec mod_disk_cache mod_cgi mod_version mod_perl mod_php5 mod_ssl mod_wsgi"
"2011 Can-Am Commander 800R XT vs. 2011 Kubota RTV900XT Worksite Orange S vs. 2011 Polaris Ranger RZR 800 S Black / Orange Madness LE---","2011 Can-Am Commander 800R XT vs. 2011 Kubota RTV900XT Worksite Orange S vs. 2011 Polaris Ranger RZR 800 S Black / Orange Madness LE------Polaris Ranger RZR 800 S Black / Orange Madness LE Kubota RTV900XT Worksite Orange S---2011 Can-Am Commander 800R XT vs 2011 Kubota RTV900XT Worksite Orange S vs 2011 Polaris Ranger RZR 800 S Black / Orange Madness LE"
"SpinningÂ® Ridebook Vol. 2 - A Must Have For SpinningÂ® Instructors---","SpinningÂ® Ridebook Vol. 2 - A Must Have For SpinningÂ® Instructors------Consumer SpinnerÂ® Bike Feature Comparison Join us and transform yours! We're happy to motivate anybody on the planet to exercise with us because we love transforming lives through the Spinning program. The Spinning program offers a unique, time-tested experience that motivates riders to push themselves and achieve real results. Results drive you, you drive us. Your stories, your commitment, your resultsâ€”inside and outâ€”drive us to do what we do. So please connect with us and share how you're exercising your mind, body and soul through Spinning. Driven by Results Spinning is authentic. Itâ€™s true to its cycling roots, yet refined to a simplicity that makes it the perfect program for any age or ability. More than 20 years ago, the SpinnerÂ® bike and Spinning program were our contributions to bringing cycling indoors and innovating a way to change peopleâ€™s lives. Today, weâ€™re still changing lives, still innovating and still holding true to our cycling roots and the authenticity that has inspired millions of people to live healthier, happier lives. 100% Authentic Passion propels us. Passion created the SpinningÂ® program, and passion drives us to continue to make it the best indoor cycling program in the world. It's our shared passion for cycling and personal achievement that moves us to vigorously develop and perfect our---Free Shipping Offer Details: Applies to SpinnerÂ® bikes only. Additional shipping charges will be added if your order contains ineligible items. Applies to delivery within the Continental U.S. only. Additional charges apply to shipments outside the Continental U.S. including Hawaii and Alaska. A customer service representative will contact you with the associated fees. Applies to curbside delivery only. Inside delivery of your SpinnerÂ® bike is subject to additional charges. For further assistance, please call Customer Service at 1.800.847.7746. Does not apply to APO/FPO addresses. Weekend delivery cannot be requested. Free Shipping applies to a maximum purchase of two SpinnerÂ® bikes. We reserve the right to change or discontinue Free Shipping on SpinnerÂ® bikes at any time. Stay Connected!"
"Colorado 13ers Mountains & Rocks Page 3 : SummitPost---","Colorado 13ers Mountains & Rocks Page 3 : SummitPost------Advanced Â Â  Â Â  Colorado 13ers Fact Sheets All Fact Sheets In Object Title Colorado 13ers Huts & Campgrounds All Huts & Campgrounds In Object Title Colorado 13ers Trailheads All Trailheads In Object Title Colorado 13ers Lists All Lists In Object Title Colorado 13ers FAQs All FAQs In Object Title Colorado 13ers Logistical Centers All Logistical Centers In Object Title Colorado 13ers Canyons All Canyons In Object Title Colorado 13ers Custom Objects All Custom Objects In Object Title---Search In Name Only Name and Body Display List Format Map Format Continent All Country All US State All Activities All Distance Any 1 5 10 20 50 100 500 Miles Kilometers From OR Created Within"
"Spitzer House Bed & Breakfast B&B (Medina) : voir 27 avis---","Spitzer House Bed & Breakfast B&B (Medina) : voir 27 avis------Voir Ã©galement ces hÃ©bergements Ã  Medina ou ses environs Vous aimerez peut-Ãªtre aussi ces hÃ´tels... , {""calendarOptions"" : {""parentContainer"" : ""HSCS"", ""fontSize"" : ""1em""}}); ta.trk(""ChangeDates"");"" alt="""" id=""lazyload_-718429829_22"" class=""change_dates_button pointer hidden "" onmouseover=""this.src=""http://static.tacdn.com/img2/langs/fr/buttons/changeDates_hover.png"""" src=""http://static.tacdn.com/img2/x.gif"" /> Voir les prix DÃ©part ArrivÃ©e (1) Autre Vus---Ã€ proximitÃ© de Spitzer House Bed & Breakfast ActivitÃ©s les mieux notÃ©es Ã  proximitÃ© 140 avis Castle Noel"
"---","------Win-Loss record when ...Â  256Â  4Â  14Â  34Â  31Â  43Â  44Â  23Â  20Â  17Â  26Â  OpponentsÂ  191Â  3Â  26Â  17Â  27Â  26Â  12Â  23Â  22Â  20Â  15Â  Massachusetts Â  TotalÂ  EXÂ  9Â  8Â  7Â  6Â  5Â  4Â  3Â  2Â  1Â  Inning-by-inningÂ  Games---Â 5-23Â  Â Â Â Â  After 6 leadingÂ  Â 10-4Â  ... trailingÂ  Â 3-21Â  ... tiedÂ  Â 2-6Â  After 7 leadingÂ  Â 11-4Â  ... trailingÂ  Â 2-23Â  ... tiedÂ  Â 2-4Â  After 8 leadingÂ  Â 11-2Â  ... trailingÂ  Â 1-26Â  ... tiedÂ  Â 3-3Â  Â  Hit 0 home runsÂ  Â 10-26Â  ... 1 home runÂ  Â 4-5Â  ... 2+ home runsÂ  Â 1-0Â  Â  Opponent 0 home runsÂ  Â 10-22Â  ... 1 home runÂ  Â 4-4Â  ... 2+ HRsÂ  Â 1-5Â "
"Uncle Bob's Self Storage at 9706 Manchaca Road, Austin - Rent Storage Units---","Uncle Bob's Self Storage at 9706 Manchaca Road, Austin - Rent Storage Units------Most of all the person with who I talked seemed to care. June 29, 2015 Austin, TX By Joseph 5 stars 5.0 out of 28 Customer Reviews 4.5 Â  Likely to Recommend 4.4 Â  Satisfaction 4.3 Â  Expectations 4.6 Â  Appearance/Cleanliness 4.5 Â  Helpful/Friendly Staff 120 Customer Ratings (4.5 out 5) Review Us Today! We survey our customers at various points of---4.9 out of 5 stars By Christina Corpus Christi, TX June 26, 2015 Service was excellent! Staff Â  4.7 Cleanliness Â  5.0 Expectations Â  5.0 Satisfaction Â  5.0 Recommend Â  5.0 4.8 out of 5 stars By Pedro Austin, TX June 26, 2015 They were helpfull in every way Staff Â "
"Calendar Availability---","Calendar Availability------July 2015 Last Updated: 1/9/2014 Nights Unavailable Grand Lodge Peak 7 Ski-In Ski-Out 1BR 1BA ONLY $1,500 1/11-18 #393187 Calendar Availability var paramValue = getParameterByName('k_clickid'); if (null != paramValue) analyticsdatalayer.ppc=paramValue; analyticsdatalayer.proctor = ""vbl:0,vbf:1,vbg:0,vbi:0,vbj:0,tstVrboTypeaheadStab:0""; analyticsdatalayer.pagename = ""standalone_view calendar""; analyticsdatalayer.pagetype = ""property""; analyticsdatalayer.optimizely = ""145865371""; analyticsdatalayer.sensitive = ""false""; analyticsdatalayer.visitortype = ""traveler""; analyticsdatalayer.pageflow = ""-1""; analyticsdatalayer.appenvironment = ""production""; analyticsdatalayer.appversion = ""1.43447.0""; analyticsdatalayer.appname = ""vrbo""; analyticsdatalayer.monikerbrand = ""vrbo""; analyticsdatalayer.brand = ""vrbo""; var analyticsdatalayer = analyticsdatalayer || {};---13 14 15 16 17 18 19 20 21 22 23 24 25 26 27 28 29 30 31 August 2015 S M T W T F S 1 2 3 4 5 6 7 8 9 10 11 12 13 14 15 16 17 18 19 20 21 22 23 24"
"Vanderbilt Official Athletic Site - Women's Lacrosse---","Vanderbilt Official Athletic Site - Women's Lacrosse------Â SummaryÂ  Lacrosse Box Score (Final) 2014 Vanderbilt Lacrosse Vanderbilt vs #5 Northwestern (May 1, 2014 at Evanston, Ill.) Lacrosse Box Score Â  Â  Play-by-Play Box Score Vanderbilt vs Northwestern (May 1, 2014) Recap }); googletag.display('div-gpt-2520295'); googletag.enableServices(); googletag.pubads().enableSyncRendering(); .setTargeting(""sect"", ""wlacros""); .setTargeting(""dc_ref"", encodeURIComponent(location.href)) .setTargeting(""dcopt"", ""ist"") .setTargeting(""firstpage"", adFirstpage) .setTargeting(""superleader"",""pushdown"") .setTargeting(""session"", MadisonSessionCode) .setTargeting(""legacy"", ""superleaderpushdown"") .setTargeting(""pos"", ""top"") .addService(googletag.pubads()) .defineSizeMapping(gptMap_superleaderpushdown) googletag.defineSlot('/4177/CSTV.VAND/SPORTS.WLACROS.STATS.20132014', [[970,66],[970,90],[728,90],[320,50]], 'div-gpt-2520295') googletag.cmd.push(function(){ } build(); addSize([100,50],[[970,66],[970,90]]). var gptMap_superleaderpushdown = googletag.sizeMapping(). else if(typeof(gptMap_superleaderpushdown) == 'undefined'){ // NON-RESPONSIVE MAINTAIN FULL SIZE ONLY } build(); addSize([300,50],[320,50]). addSize([768,90],[728,90]). addSize([1024,90],[[970,66],[970,90]]). var gptMap_superleaderpushdown = googletag.sizeMapping(). if(typeof(gptMap_superleaderpushdown) == 'undefined' && (window.oas_site_config && window.oas_site_config.responsive)){ // RESPONSIVE---NorthwesternÂ  6Â  6Â  12Â  Vanderbilt SCORING: GOALS: Doherty, Jill 5; Lockwood, Amanda 2; Dagres, Emma 1; Chandler, Kelly 1. ASSISTS: Dagres, Emma 1; Doherty, Jill 1; Schonk, Mallory 1. Northwestern SCORING: GOALS: Mupo, Kara 5; Rich, Kelly 2; Leonard, Alyssa 2; Turner, Christy 1; DeRonda, Kat 1; Macdonald, Kate 1. ASSISTS: Rich, Kelly 2; Turner, Christy 2; Carroll, Jess 1. Officials:. Â Northwestern Â  Pos ## Player G A Sh GB DC TO CT FPS Fouls A Â  2 Â  Leonard, Alyssa Â  2Â  0Â  4Â  0Â "
"Hack-a-Day - Badge, iron-on patch ID: 503 - $3.00 : Adafruit Industries, Unique & fun DIY electronics and kits---","Hack-a-Day - Badge, iron-on patch ID: 503 - $3.00 : Adafruit Industries, Unique & fun DIY electronics and kits------$3.00 PRODUCT ID: 503 Hack-a-Day - Badge, iron-on patch CREATE DESCRIPTION NAME CREATE NEW WISHLIST Ã— Hack-a-Day - Badge, iron-on patch / Badges Accessories / VIDEOS FORUMS MINI UNTZTRUMENT: 3D PRINTED MIDI CONTROLLER---IN STOCK Add to Cart QTY DISCOUNT 1-9 $3.00 10-99 $2.70 100+ $2.40 IN STOCK ADD TO WISHLIST Description Description- You're on Hack-a-day! Adafruit offers a fun and exciting ""badges"" of achievement for electronics, science and engineering. We believe everyone should be able to be rewarded for learning a useful skill, a badge is just one of the many ways to show and share. This is the ""My project was featured on Hack-a-day!"" badge for use with educators, classrooms, workshops, Maker Faires, TechShops, Hackerspaces, Makerspaces and around the"
"2011-2012 NCAA BB Games: Sooners Wildcats---","2011-2012 NCAA BB Games: Sooners Wildcats------Final NCAA Basketball Login Sign Up Blog Players Teams Southwest Pacific Northwest Southeast Central Atlantic Divisions Standings Scores Schedules ATS Trends Win/Loss Trends Trends Line Movement Odds History Vegas Odds Odds More... 2H Points Per Game 1H Points Per Game 3 Point Shooting % FTA Per FGA Def. Rebounding % Off. Rebounding % Turnover % Effective Field Goal % Defensive Efficiency Offensive Efficiency Stats More... Consistency Luck Non-Division In-Division Away Home Last 10 Games Future SOS Strength Of Schedule Predictive Rankings Prediction Accuracy Season Projections Most Likely Upsets Game Winner Picks Predictions Betting Picks Grid---ATS Pick Confidence Projection KSST -11.5 OKLA 48.6% KSST 51.4% Totals Pick Confidence Projection Under 139.5 Over 48.9% Under 51.1% Money Line Value Pick Confidence Projection KSST -750 OKLA -3.5% KSST +1.1% Final Score Projection Vegas Implied Actual OKLA 65.6 64.0 63 KSST 76.6 75.5 60 Offensive Stat Comparison"
"-- DePaul vs Princeton---","-- DePaul vs Princeton------Â  Â  3 Â  4 Â  Â  DePaul Â  Princeton Â  Mar 07, 2013 at Princeton, NJ (Jadwin Gym) Live Match Update DePaul vs Princeton---#2 SINGLES Â Â 1Â Â  Â Â 2Â Â  Â Â 3Â Â  Notes Fargas, Patricia, DePaul 2 6 1 Order of finish: 6 Muliawan, Amanda, Princeton 6 3 6 #3 SINGLES Â Â 1Â Â  Â Â 2Â Â  Â Â 3Â Â  Notes Vladutu, Ana, DePaul 6 6 Order of finish: 2 Chow, Monica, Princeton 3 4 #4 SINGLES Â Â 1Â Â  Â Â 2Â Â  Â Â 3Â Â  Notes Lawson, Kelsey, DePaul 0 6 2 Order of"
"Capital Lighting C9042MN474 Midtown Down Light Pendant Light - Matte Nickel at Shop.Ferguson.com---","Capital Lighting C9042MN474 Midtown Down Light Pendant Light - Matte Nickel at Shop.Ferguson.com------Details and Dimensions else window.attachEvent('onload', bcLoad); else if(window.addEventListener) window.addEventListener('load', bcLoad, false); else if(document.readyState==""complete"") bcLoad(); if(window.pageViewer && pageViewer.load) pageViewer.load(); }; var s = document.getElementsByTagName('script')[0]; s.parentNode.insertBefore(vms, s); vms.src = ('https:'==document.location.protocol?'https://':'http://') + ""vmss.boldchat.com/aid/617954300543514235/bc.vms4/vms.js""; var vms = document.createElement(""script""); vms.type = ""text/javascript""; vms.async = true; if(window.bcLoaded) return; window.bcLoaded = true; var bcLoad = function(){ _bcvma.push([""addText"", {type: ""chat"", department: ""3953814360911440131"", window: ""324287941159832142"", available: '', unavailable: """", id: bccbId}]); _bcvma.push([""setAccountID"", ""617954300543514235""]); window._bcvma = window._bcvma || []; var bccbId = Math.random(); document.write(unescape('%3Cdiv id=' + bccbId + '%3E%3C/div%3E')); }); }); return false; } s.tl(this,'o','Chat'); s.events='event16'; s.linkTrackEvents='event16'; s.linkTrackVars='events'; var s=s_gi(s_account); if (typeof s_account != 'undefined') { submitRKGMicroEvent({type:'chat', valcent:600}); jQuery('body').on('click', "".ferg_boldchat"", function (e) { jQuery(document).ready( function () {---Lumens Comparison Chart View More Entire Collection Capital Lighting C3910MN457 Drum Pendant Matte Nickel $210.00 Add to Cart Capital Lighting C9047MN478 Down Light Pendant Matte Nickel $232.12"
"Kohler K2005-L-0 Kingston Wall Hung Bathroom Sink - White at Shop.Ferguson.com---","Kohler K2005-L-0 Kingston Wall Hung Bathroom Sink - White at Shop.Ferguson.com------Details and Dimensions else window.attachEvent('onload', bcLoad); else if(window.addEventListener) window.addEventListener('load', bcLoad, false); else if(document.readyState==""complete"") bcLoad(); if(window.pageViewer && pageViewer.load) pageViewer.load(); }; var s = document.getElementsByTagName('script')[0]; s.parentNode.insertBefore(vms, s); vms.src = ('https:'==document.location.protocol?'https://':'http://') + ""vmss.boldchat.com/aid/617954300543514235/bc.vms4/vms.js""; var vms = document.createElement(""script""); vms.type = ""text/javascript""; vms.async = true; if(window.bcLoaded) return; window.bcLoaded = true; var bcLoad = function(){ _bcvma.push([""addText"", {type: ""chat"", department: ""3953814360911440131"", window: ""324287941159832142"", available: '', unavailable: """", id: bccbId}]); _bcvma.push([""setAccountID"", ""617954300543514235""]); window._bcvma = window._bcvma || []; var bccbId = Math.random(); document.write(unescape('%3Cdiv id=' + bccbId + '%3E%3C/div%3E')); }); }); return false; } s.tl(this,'o','Chat'); s.events='event16'; s.linkTrackEvents='event16'; s.linkTrackVars='events'; var s=s_gi(s_account); if (typeof s_account != 'undefined') { submitRKGMicroEvent({type:'chat', valcent:600}); jQuery('body').on('click', "".ferg_boldchat"", function (e) { jQuery(document).ready( function () {---Warranty View More Entire Collection Kohler K2005-0 Wall Hung Bathroom Sink White Faucet Hole Configuration: 4'' Centerset Overall Size: 21-1/4 x 18-1/8 x 12-1/4 $82.15 Add to Cart Kohler K2007-0 Wall Hung Bathroom Sink White Faucet Hole Configuration: Single-Hole Overall Size: 21-1/4 x 18-1/8 x"
"[pcre] Contents of /code/trunk/pcre_study.c---","[pcre] Contents of /code/trunk/pcre_study.c------Add pcre16 prefix to 16 bit structs File size: 42455 byte(s) File MIME type: text/plain zherczeg Thu Jan 5 19:18:12 2012 UTC (3 years, 6 months ago) by show annotations) 852 - ( Revision Parent Directory | Revision Log Contents of /code/trunk/pcre_study.c /[pcre]/code/trunk/pcre_study.c---Properties Name Value svn:eol-style native svn:keywords ""Author Date Id Revision Url"" Â  ViewVC Help Powered by ViewVC 1.1.5 Â "
